title,year,venue,cited_by,type,arxiv,doi,authors,abstract
Toward expert-level medical question answering with large language models,2025,Nature Medicine,677,article,,10.1038/s41591-024-03423-7,"K. K. Singhal, Tao Tu, Juraj Gottweis et al.","Large language models (LLMs) have shown promise in medical question answering, with Med-PaLM being the first to exceed a 'passing' score in United States Medical Licensing Examination style questions. However, challenges remain in long-form medical question answering and handling real-world workflows. Here, we present Med-PaLM 2, which bridges these gaps with a combination of base LLM improvements, medical domain fine-tuning and new strategies for improving reasoning and grounding through ensemb"
Lost in the Middle: How Language Models Use Long Contexts,2024,Transactions of the Association for Computational Linguistics,862,article,,10.1162/tacl_a_00638,"Nelson F. Liu, Kevin Lin, John Hewitt et al.","Abstract While recent language models have the ability to take long contexts as input, relatively little is known about how well they use longer context. We analyze the performance of language models on two tasks that require identifying relevant information in their input contexts: multi-document question answering and key-value retrieval. We find that performance can degrade significantly when changing the position of relevant information, indicating that current language models do not robustl"
Attention is not all you need: the complicated case of ethically using large language models in healthcare and medicine,2023,EBioMedicine,434,review,,10.1016/j.ebiom.2023.104512,Stefan Harrer,"Large Language Models (LLMs) are a key component of generative artificial intelligence (AI) applications for creating new content including text, imagery, audio, code, and videos in response to textual instructions. Without human oversight, guidance and responsible design and operation, such generative AI applications will remain a party trick with substantial potential for creating and spreading misinformation or harmful and inaccurate content at unprecedented scale. However, if positioned and "
"A Survey on Large Language Models: Applications, Challenges, Limitations, and Practical Usage",2023,,349,preprint,,10.36227/techrxiv.23589741.v1,"Muhammad Usman Hadi, qasem al tashi, Rizwan Qureshi et al.","Within the vast expanse of computerized language processing, a revolutionary entity known as Large Language Models (LLMs) has emerged, wielding immense power in its capacity to comprehend intricate linguistic patterns and conjure coherent and contextually fitting responses. Large language models (LLMs) are a type of artificial intelligence (AI) that have emerged as powerful tools for a wide range of tasks, including natural language processing (NLP), machine translation, and question-answering. "
The promise and challenges of generative AI in education,2024,Behaviour and Information Technology,297,article,,10.1080/0144929x.2024.2394886,"Michail N. Giannakos, Roger Azevedo, Peter Brusilovsky et al.","Generative artificial intelligence (GenAI) tools, such as large language models (LLMs), generate natural language and other types of content to perform a wide range of tasks. This represents a significant technological advancement that poses opportunities and challenges to educational research and practice. This commentary brings together contributions from nine experts working in the intersection of learning and technology and presents critical reflections on the opportunities, challenges, and "
The Rise and Potential of Large Language Model Based Agents: A Survey,2023,arXiv (Cornell University),250,preprint,2309.07864,10.48550/arxiv.2309.07864,"Zhiheng Xi, Wen-Xiang Chen, Xin Guo et al.","For a long time, humanity has pursued artificial intelligence (AI) equivalent to or surpassing the human level, with AI agents considered a promising vehicle for this pursuit. AI agents are artificial entities that sense their environment, make decisions, and take actions. Many efforts have been made to develop intelligent agents, but they mainly focus on advancement in algorithms or training strategies to enhance specific capabilities or performance on particular tasks. Actually, what the commu"
A Comprehensive Overview of Large Language Models,2023,arXiv (Cornell University),357,preprint,2307.06435,10.48550/arxiv.2307.06435,"Humza Naveed, Asad Ullah Khan, Shi Qiu et al.","Large Language Models (LLMs) have recently demonstrated remarkable capabilities in natural language processing tasks and beyond. This success of LLMs has led to a large influx of research contributions in this direction. These works encompass diverse topics such as architectural innovations, better training strategies, context length improvements, fine-tuning, multi-modal LLMs, robotics, datasets, benchmarking, efficiency, and more. With the rapid development of techniques and regular breakthrou"
"The interplay of learning, analytics and artificial intelligence in education: A vision for hybrid intelligence",2024,British Journal of Educational Technology,152,article,,10.1111/bjet.13514,Mutlu Cukurova,"Abstract This paper presents a multidimensional view of AI's role in education, emphasising the intricate interplay among AI, analytics and human learning processes. Here, I challenge the prevalent narrow conceptualisation of AI as tools in Education, exemplified in generative AI tools, and argue for the importance of alternative conceptualisations of AI for achieving human–AI hybrid intelligence. I highlight the differences between human intelligence and artificial information processing, the i"
Guest editorial: AI in education: transforming teaching and learning,2025,Information and Learning Sciences,11,editorial,,10.1108/ils-01-2025-268,"Dania Bilal, Jiangen He, Jiqun Liu","Artificial intelligence (AI) continues to evolve and transform many disciplines, including education. In education, AI has been adopted to innovate teaching and improve learning outcomes, increase productivity and efficiency, and prepare students for the future of work with AI. Governments, policymakers and educational institutions at the local and global levels have been rethinking education in the age of AI (Pedro et al., 2019). The rising interest in AI in education has been remarkable, espec"
Black Box Warning: Large Language Models and the Future of Infectious Diseases Consultation,2023,Clinical Infectious Diseases,123,article,,10.1093/cid/ciad633,"Ilan S. Schwartz, Katherine E. Link, Roxana Daneshjou et al.","Large language models (LLMs) are artificial intelligence systems trained by deep learning algorithms to process natural language and generate text responses to user prompts. Some approach physician performance on a range of medical challenges, leading some proponents to advocate for their potential use in clinical consultation and prompting some consternation about the future of cognitive specialties. However, LLMs currently have limitations that preclude safe clinical deployment in performing s"
Factuality challenges in the era of large language models and opportunities for fact-checking,2024,Nature Machine Intelligence,117,article,,10.1038/s42256-024-00881-z,"Isabelle Augenstein, Timothy Baldwin, Meeyoung Cha et al.",
What large language models know and what people think they know,2025,Nature Machine Intelligence,109,article,,10.1038/s42256-024-00976-7,"Mark Steyvers, Heliodoro Tejeda, Aakriti Kumar et al.","Abstract As artificial intelligence systems, particularly large language models (LLMs), become increasingly integrated into decision-making processes, the ability to trust their outputs is crucial. To earn human trust, LLMs must be well calibrated such that they can accurately assess and communicate the likelihood of their predictions being correct. Whereas recent work has focused on LLMs’ internal confidence, less is understood about how effectively they convey uncertainty to users. Here we exp"
The ethics of using artificial intelligence in scientific research: new guidance needed for a new tool,2024,AI and Ethics,135,article,,10.1007/s43681-024-00493-8,"David B. Resnik, Mohammad Hosseini","Using artificial intelligence (AI) in research offers many important benefits for science and society but also creates novel and complex ethical issues. While these ethical issues do not necessitate changing established ethical norms of science, they require the scientific community to develop new guidance for the appropriate use of AI. In this article, we briefly introduce AI and explain how it can be used in research, examine some of the ethical issues raised when using it, and offer nine reco"
How to build the virtual cell with artificial intelligence: Priorities and opportunities,2024,Cell,262,article,2409.11654,10.1016/j.cell.2024.11.015,"Charlotte Bunne, Yusuf Roohani, Yanay Rosen et al.","Cells are essential to understanding health and disease, yet traditional models fall short of modeling and simulating their function and behavior. Advances in AI and omics offer groundbreaking opportunities to create an AI virtual cell (AIVC), a multi-scale, multi-modal large-neural-network-based model that can represent and simulate the behavior of molecules, cells, and tissues across diverse states. This Perspective provides a vision on their design and how collaborative efforts to build AIVCs"
"Influencing human–AI interaction by priming beliefs about AI can increase perceived trustworthiness, empathy and effectiveness",2023,Nature Machine Intelligence,157,article,,10.1038/s42256-023-00720-7,"Pat Pataranutaporn, Ruby Liu, Ed Finn et al.",
"Explainable artificial intelligence: A survey of needs, techniques, applications, and future direction",2024,Neurocomputing,147,article,2409.00265,10.1016/j.neucom.2024.128111,"Melkamu Abay Mersha, Khang Nhứt Lâm, Joseph Wood et al.",
Auditing large language models: a three-layered approach,2023,AI and Ethics,186,article,,10.1007/s43681-023-00289-2,"Jakob Mökander, Jonas Schuett, Hannah Rose Kirk et al.","Abstract Large language models (LLMs) represent a major advance in artificial intelligence (AI) research. However, the widespread use of LLMs is also coupled with significant ethical and social challenges. Previous research has pointed towards auditing as a promising governance mechanism to help ensure that AI systems are designed and deployed in ways that are ethical, legal, and technically robust. However, existing auditing procedures fail to address the governance challenges posed by LLMs, wh"
Artificial intelligence in innovation management: A review of innovation capabilities and a taxonomy of <scp>AI</scp> applications,2023,Journal of Product Innovation Management,264,review,,10.1111/jpim.12698,"Fábio Gama, Stefano Magistretti","Abstract Artificial intelligence (AI) is a promising generation of digital technologies. Recent applications and research suggest that AI can not only influence but also accelerate innovation in organizations. However, as the field is rapidly growing, a common understanding of the underlying theoretical capabilities has become increasingly vague and fraught with ambiguity. In view of the centrality of innovation capabilities in making innovation happen, we bring together these scattered perspect"
"Human-in-the-Loop Reinforcement Learning: A Survey and Position on Requirements, Challenges, and Opportunities",2024,Journal of Artificial Intelligence Research,130,article,,10.1613/jair.1.15348,"Carl Orge Retzlaff, Srijita Das, Christabel Wayllace et al.","Artificial intelligence (AI) and especially reinforcement learning (RL) have the potential to enable agents to learn and perform tasks autonomously with superhuman performance. However, we consider RL as fundamentally a Human-in-the-Loop (HITL) paradigm, even when an agent eventually performs its task autonomously. In cases where the reward function is challenging or impossible to define, HITL approaches are considered particularly advantageous. The application of Reinforcement Learning from Hum"
Generative artificial intelligence in innovation management: A preview of future research developments,2024,Journal of Business Research,312,article,,10.1016/j.jbusres.2024.114542,"Marcello M. Mariani, Yogesh K. Dwivedi","This study outlines the future research opportunities related to Generative Artificial Intelligence (GenAI) in innovation management. To this end, it combines a review of the academic literature with the results of a Delphi study involving leading innovation management scholars. Ten major research themes emerged that can guide future research developments at the intersection of GenAI and innovation management: 1) Gen AI and innovation types; 2) GenAI, dominant designs and technology evolution; 3"
"Overview of AI and communication for 6G network: fundamentals, challenges, and future research opportunities",2025,Science China Information Sciences,122,article,,10.1007/s11432-024-4337-1,"Qimei Cui, Xiaohu You, Wei Ni et al.","Abstract With the growing demand for seamless connectivity and intelligent communication, the integration of artificial intelligence (AI) and sixth-generation (6G) communication networks has emerged as a transformative paradigm. By embedding AI capabilities across various network layers, this integration enables optimized resource allocation, improved efficiency, and enhanced system robust performance. This paper presents a comprehensive overview of AI and communication for 6G networks, with a f"
"Large Language Models: A Comprehensive Survey of its Applications, Challenges, Limitations, and Future Prospects",2023,,104,preprint,,10.36227/techrxiv.23589741.v4,"Muhammad Usman Hadi, qasem al tashi, Rizwan Qureshi et al.","Within the vast expanse of computerized language processing, a revolutionary entity known as Large Language Models (LLMs) has emerged, wielding immense power in its capacity to comprehend intricate linguistic patterns and conjure coherent and contextually fitting responses. Large language models (LLMs) are a type of artificial intelligence (AI) that have emerged as powerful tools for a wide range of tasks, including natural language processing (NLP), machine translation, and question-answering. "
Unleashing the potential of prompt engineering for large language models,2023,arXiv (Cornell University),135,review,2310.14735,10.48550/arxiv.2310.14735,"B.‐C. CHEN, Zhaofeng Zhang, Nicolas Langrené et al.","This comprehensive review delves into the pivotal role of prompt engineering in unleashing the capabilities of Large Language Models (LLMs). The development of Artificial Intelligence (AI), from its inception in the 1950s to the emergence of advanced neural networks and deep learning architectures, has made a breakthrough in LLMs, with models such as GPT-4o and Claude-3, and in Vision-Language Models (VLMs), with models such as CLIP and ALIGN. Prompt engineering is the process of structuring inp"
The Era of Artificial Intelligence Deception: Unraveling the Complexities of False Realities and Emerging Threats of Misinformation,2024,Information,116,article,,10.3390/info15060299,"S. Williamson, Victor R. Prybutok","This study delves into the dual nature of artificial intelligence (AI), illuminating its transformative potential that has the power to revolutionize various aspects of our lives. We delve into critical issues such as AI hallucinations, misinformation, and unpredictable behavior, particularly in large language models (LLMs) and AI-powered chatbots. These technologies, while capable of manipulating human decisions and exploiting cognitive vulnerabilities, also hold the key to unlocking unpreceden"
"""I'm Not Sure, But..."": Examining the Impact of Large Language Models' Uncertainty Expression on User Reliance and Trust",2024,,97,preprint,2405.00623,10.1145/3630106.3658941,"Sunnie S. Y. Kim, Q. Vera Liao, Mihaela Vorvoreanu et al.","Widely deployed large language models (LLMs) can produce convincing yet incorrect outputs, potentially misleading users who may rely on them as if they were correct. To reduce such overreliance, there have been calls for LLMs to communicate their uncertainty to end users. However, there has been little empirical work examining how users perceive and act upon LLMs’ expressions of uncertainty. We explore this question through a large-scale, pre-registered, human-subject experiment (N=404) in which"
"Explainable Generative AI (GenXAI): a survey, conceptualization, and research agenda",2024,Artificial Intelligence Review,109,article,,10.1007/s10462-024-10916-x,Johannes Schneider,"Abstract Generative AI (GenAI) represents a shift from AI’s ability to “recognize” to its ability to “generate” solutions for a wide range of tasks. As generated solutions and applications grow more complex and multi-faceted, new needs, objectives, and possibilities for explainability (XAI) have emerged. This work elaborates on why XAI has gained importance with the rise of GenAI and the challenges it poses for explainability research. We also highlight new and emerging criteria that explanation"
Evaluating large language model workflows in clinical decision support for triage and referral and diagnosis,2025,npj Digital Medicine,84,article,,10.1038/s41746-025-01684-1,"Farieda Gaber, Maqsood Shaik, Fabio Allega et al.","Accurate medical decision-making is critical for both patients and clinicians. Patients often struggle to interpret their symptoms, determine their severity, and select the right specialist. Simultaneously, clinicians face challenges in integrating complex patient data to make timely, accurate diagnoses. Recent advances in large language models (LLMs) offer the potential to bridge this gap by supporting decision-making for both patients and healthcare providers. In this study, we benchmark multi"
Adversarial machine learning :,2024,,105,report,,10.6028/nist.ai.100-2e2023,"Apostol Vassilev, Alina Oprea, Alie Jean Fordyce et al.","This NIST AI report develops a taxonomy of concepts and defines terminology in the field of adversarial machine learning (AML). The taxonomy is built on survey of the AML literature and is arranged in a conceptual hierarchy that includes key types of ML methods and lifecycle stage of attack, attacker goals and objectives, and attacker capabilities and knowledge of the learning process. The report also provides corresponding methods for mitigating and managing the consequences of attacks and poin"
How understanding large language models can inform the use of ChatGPT in physics education,2023,European Journal of Physics,90,article,,10.1088/1361-6404/ad1420,"Giulia Polverini, Bor Gregorcic","Abstract The paper aims to fulfil three main functions: (1) to serve as an introduction for the physics education community to the functioning of large language models (LLMs), (2) to present a series of illustrative examples demonstrating how prompt-engineering techniques can impact LLMs performance on conceptual physics tasks and (3) to discuss potential implications of the understanding of LLMs and prompt engineering for physics teaching and learning. We first summarise existing research on th"
Hallucination‐Free? Assessing the Reliability of Leading <scp>AI</scp> Legal Research Tools,2025,Journal of Empirical Legal Studies,83,article,,10.1111/jels.12413,"Varun Magesh, Faiz Surani, Matthew Dahl et al.","ABSTRACT Legal practice has witnessed a sharp rise in products incorporating artificial intelligence (AI). Such tools are designed to assist with a wide range of core legal tasks, from search and summarization of caselaw to document drafting. However, the large language models used in these tools are prone to “hallucinate,” or make up false information, making their use risky in high‐stakes domains. Recently, certain legal research providers have touted methods such as retrieval‐augmented genera"
Industrial applications of large language models,2025,Scientific Reports,100,article,,10.1038/s41598-025-98483-1,"Mubashar Raza, Zarmina Jahangir, Muhammad Bilal Riaz et al.","Large language models (LLMs) are artificial intelligence (AI) based computational models designed to understand and generate human like text. With billions of training parameters, LLMs excel in identifying intricate language patterns, enabling remarkable performance across a variety of natural language processing (NLP) tasks. After the introduction of transformer architectures, they are impacting the industry with their text generation capabilities. LLMs play an innovative role across various in"
Generative AI in Higher Education: Balancing Innovation and Integrity,2025,British Journal of Biomedical Science,142,review,,10.3389/bjbs.2024.14048,"Nigel Francis, Sue Jones, David P. Smith","Generative Artificial Intelligence (GenAI) is rapidly transforming the landscape of higher education, offering novel opportunities for personalised learning and innovative assessment methods. This paper explores the dual-edged nature of GenAI's integration into educational practices, focusing on both its potential to enhance student engagement and learning outcomes and the significant challenges it poses to academic integrity and equity. Through a comprehensive review of current literature, we e"
The Uneven Impact of Generative AI on Entrepreneurial Performance,2023,,147,preprint,,10.31219/osf.io/hdjpk,"Nicholas G. Otis, Rowan Philip Clarke, Solène Delecourt et al.","Scalable and low-cost AI assistance has the potential to improve firm decision-making and economic performance. However, running a business involves a myriad of open-ended problems, making it difficult to know whether recent AI advances can help business owners make better decisions in real-world markets. In a field experiment with Kenyan entrepreneurs, we assessed the impact of AI advice on small business revenues and profits by randomizing access to a GPT-4-powered AI business assistant via Wh"
Exploring collaborative decision-making: A quasi-experimental study of human and Generative AI interaction,2024,Technology in Society,118,article,,10.1016/j.techsoc.2024.102662,"Xinyue Hao, Emrah Demir, Daniel Eyers","This paper explores the effects of integrating Generative Artificial Intelligence (GAI) into decision-making processes within organizations, employing a quasi-experimental pretest-posttest design. The study examines the synergistic interaction between Human Intelligence (HI) and GAI across four group decision-making scenarios within three global organizations renowned for their cutting-edge operational techniques. The research progresses through several phases: identifying research problems, col"
Character-LLM: A Trainable Agent for Role-Playing,2023,,99,article,,10.18653/v1/2023.emnlp-main.814,"Yunfan Shao, Linyang Li, Junqi Dai et al.","Large language models (LLMs) can be used to serve as agents to simulate human behaviors, given the powerful ability to understand human instructions and provide high-quality generated texts. Such ability stimulates us to wonder whether LLMs can simulate a person in a higher form than simple human behaviors. Therefore, we aim to train an agent with the profile, experience, and emotional states of a specific person instead of using limited prompts to instruct ChatGPT API. In this work, we introduc"
Artificial intelligence risk management framework :,2024,,90,report,,10.6028/nist.ai.600-1,National Institute of Standards and Technology (US),"This document is a cross-sectoral profile of and companion resource for the AI Risk Management Framework (AI RMF 1.0) for Generative AI, 1 pursuant to President Biden’s Executive Order (EO) 14110 on Safe, Secure, and Trustworthy Artificial Intelligence.2 The AI RMF was released in January 2023, and is intended for voluntary use and to improve the ability of organizations to incorporate trustworthiness considerations into the design, development, use, and evaluation of AI products, services, and "
Large language models for disease diagnosis: a scoping review,2025,npj Artificial Intelligence,74,review,,10.1038/s44387-025-00011-z,"Shuang Zhou, Zidu Xu, Mian Zhang et al.","Automatic disease diagnosis has become increasingly valuable in clinical practice. The advent of large language models (LLMs) has catalyzed a paradigm shift in artificial intelligence, with growing evidence supporting the efficacy of LLMs in diagnostic tasks. Despite the increasing attention in this field, a holistic view is still lacking. Many critical aspects remain unclear, such as the diseases and clinical data to which LLMs have been applied, the LLM techniques employed, and the evaluation "
Establishing the importance of co-creation and self-efficacy in creative collaboration with artificial intelligence,2024,Scientific Reports,86,article,,10.1038/s41598-024-69423-2,"Jack McGuire, David De Cremer, Tim Van de Cruys","The emergence of generative AI technologies has led to an increasing number of people collaborating with AI to produce creative works. Across two experimental studies, in which we carefully designed and programmed state-of-the-art human-AI interfaces, we examine how the design of generative AI systems influences human creativity (poetry writing). First, we find that people were most creative when writing a poem on their own, compared to first receiving a poem generated by an AI system and using "
