title,year,venue,cited_by,type,arxiv,doi,authors,abstract
Artificial intelligence for literature reviews: opportunities and challenges,2024,Artificial Intelligence Review,176,article,,10.1007/s10462-024-10902-3,"F. J. Bolaños, Angelo A. Salatino, Francesco Osborne et al.","Abstract This paper presents a comprehensive review of the use of Artificial Intelligence (AI) in Systematic Literature Reviews (SLRs). A SLR is a rigorous and organised methodology that assesses and integrates prior research on a given topic. Numerous tools have been developed to assist and partially automate the SLR process. The increasing role of AI in this field shows great potential in providing more effective support for researchers, moving towards the semi-automatic creation of literature"
The Role of Artificial Intelligence in Improving Workplace Well-Being: A Systematic Review,2024,Businesses,43,review,,10.3390/businesses4030024,"Miguel-Ángel García-Madurga, Ana Isabel Gil‐Lacruz, María Isabel Saz Gil et al.","In recent years, the use of artificial intelligence (AI) has significantly increased in the field of workplace well-being. This study systematically reviews the most common applications of AI in this context, covering literature published between 2018 and 2023, and evaluates both its current and potential impact. The research involved a comprehensive search in the Scopus and Web of Science databases, following PRISMA guidelines, resulting in 31 articles that met the inclusion criteria. The quali"
Exploring factors influencing user perspective of ChatGPT as a technology that assists in healthcare decision making: A cross sectional survey study,2024,PLoS ONE,42,article,,10.1371/journal.pone.0296151,"Avishek Choudhury, Safa Elkefi, Achraf Tounsi","As ChatGPT emerges as a potential ally in healthcare decision-making, it is imperative to investigate how users leverage and perceive it. The repurposing of technology is innovative but brings risks, especially since AI's effectiveness depends on the data it's fed. In healthcare, ChatGPT might provide sound advice based on current medical knowledge, which could turn into misinformation if its data sources later include erroneous information. Our study assesses user perceptions of ChatGPT, partic"
Farsight: Fostering Responsible AI Awareness During AI Application Prototyping,2024,,48,preprint,2402.15350,10.1145/3613904.3642335,"Zijie J. Wang, Chinmay Kulkarni, Lauren Wilcox et al.","Prompt-based interfaces for Large Language Models (LLMs) have made prototyping and building AI-powered applications easier than ever before. However, identifying potential harms that may arise from AI applications remains a challenge, particularly during prompt-based prototyping. To address this, we present Farsight, a novel in situ interactive tool that helps people identify potential harms from the AI applications they are prototyping. Based on a user’s prompt, Farsight highlights news article"
Teaching Ethics in Computing: A Systematic Literature Review of ACM Computer Science Education Publications,2023,ACM Transactions on Computing Education,88,article,,10.1145/3634685,"Noelle Brown, Benjamin Xie, Ella Sarder et al.","The computing education research community now has at least 40 years of published research on teaching ethics in higher education. To examine the state of our field, we present a systematic literature review of papers in the Association for Computing Machinery computing education venues that describe teaching ethics in higher-education computing courses. Our review spans all papers published to SIGCSE, ICER, ITiCSE, CompEd, Koli Calling, and TOCE venues through 2022, with 100 papers fulfilling o"
"Unveiling trust in AI: the interplay of antecedents, consequences, and cultural dynamics",2025,AI & Society,37,article,,10.1007/s00146-025-02477-6,"Qinpu Dang, Guiquan Li","Trust in artificial intelligence (AI) has become a central issue due to the opacity and unpredictability of AI decision-making processes. However, existing studies often produce inconsistent results and fail to provide a unified understanding of the underlying factors, making a comprehensive review necessary. To address this gap, we conducted a systematic review of 562 empirical studies to explore the antecedents and consequences of human trust in AI. The review identified key antecedents of tru"
"Fostering Appropriate Reliance on Large Language Models: The Role of Explanations, Sources, and Inconsistencies",2025,,32,preprint,2502.08554,10.1145/3706598.3714020,"Sunnie S. Y. Kim, Jennifer Wortman Vaughan, Q. Vera Liao et al.","Large language models (LLMs) can produce erroneous responses that sound fluent and convincing, raising the risk that users will rely on these responses as if they were correct. Mitigating such overreliance is a key challenge. Through a think-aloud study in which participants use an LLM-infused application to answer objective questions, we identify several features of LLM responses that shape users' reliance: explanations (supporting details for answers), inconsistencies in explanations, and sour"
Using ChatGPT and Persuasive Technology for Personalized Recommendation Messages in Hotel Upselling,2023,Information,28,article,,10.3390/info14090504,"Manolis Remountakis, Konstantinos Kotis, Babis Kourtzis et al.","Recommender systems have become indispensable tools in the hotel hospitality industry, enabling personalized and tailored experiences for guests. Recent advancements in large language models (LLMs), such as ChatGPT, and persuasive technologies have opened new avenues for enhancing the effectiveness of those systems. This paper explores the potential of integrating ChatGPT and persuasive technologies for automating and improving hotel hospitality recommender systems. First, we delve into the capa"
Using AI Assistants in Software Development: A Qualitative Study on Security Practices and Concerns,2024,,18,preprint,2405.06371,10.1145/3658644.3690283,"Jan H. Klemmer, Stefan Albert Horstmann, Nikhil Patnaik et al.","Following the recent release of AI assistants, such as OpenAI's ChatGPT and GitHub Copilot, the software industry quickly utilized these tools for software development tasks, e.g., generating code or consulting AI for advice. While recent research has demonstrated that AI-generated code can contain security issues, how software professionals balance AI assistant usage and security remains unclear. This paper investigates how software professionals use AI assistants in secure software development"
User Experience Design Professionals' Perceptions of Generative Artificial Intelligence,2023,arXiv (Cornell University),12,preprint,2309.15237,10.48550/arxiv.2309.15237,"Jie Li, Hancheng Cao, Laura Lin et al.","Among creative professionals, Generative Artificial Intelligence (GenAI) has sparked excitement over its capabilities and fear over unanticipated consequences. How does GenAI impact User Experience Design (UXD) practice, and are fears warranted? We interviewed 20 UX Designers, with diverse experience and across companies (startups to large enterprises). We probed them to characterize their practices, and sample their attitudes, concerns, and expectations. We found that experienced designers are "
Development of a generative <scp>AI</scp> ‐powered teachable agent for middle school mathematics learning: A design‐based research study,2025,British Journal of Educational Technology,22,article,,10.1111/bjet.13586,"Wanli Xing, Yukyeong Song, Chenglu Li et al.","This paper reports on a design‐based research (DBR) study that aims to devise an artificial intelligence (AI)‐powered teachable agent that supports secondary school students' learning‐by‐teaching practices of mathematics learning content. A long‐standing pedagogical practice of learning‐by‐teaching is powered by a recent advancement of generative AI technologies, yielding our teachable agent called ALTER‐Math . This study chronicles one usability testing and three cycles of iterative design and "
"Integrating Artificial Intelligence, Electronic Health Records, and Wearables for Predictive, Patient-Centered Decision Support in Healthcare",2025,Healthcare,18,article,,10.3390/healthcare13212753,"D. Prabhu, Varadraj P. Gurupur, A.V. Stone et al.","This study explores how patients and stakeholders envision integrated digital health systems. BACKGROUND/OBJECTIVES: Integrating artificial intelligence (AI), wearable data, electronic health records (EHRs), and patient-reported outcomes could enable proactive and personalized healthcare. However, current solutions remain fragmented and poorly aligned with user expectations. This study aimed to explore patient and stakeholder needs for AI-driven integration and propose a conceptual framework to "
Exploring the Human-LLM Synergy in Advancing Theory-driven Qualitative Analysis,2024,arXiv (Cornell University),7,preprint,2405.05758,10.48550/arxiv.2405.05758,"Han Meng, Yitian Yang, Fu, Wayne et al.","Qualitative coding is a demanding yet crucial research method in the field of Human-Computer Interaction (HCI). While recent studies have shown the capability of large language models (LLMs) to perform qualitative coding within theoretical frameworks, their potential for collaborative human-LLM discovery and generation of new insights beyond initial theory remains underexplored. To bridge this gap, we proposed CHALET, a novel approach that harnesses the power of human-LLM partnership to advance "
"Am I Wrong, or Is the Autograder Wrong? Effects of AI Grading Mistakes on Learning",2023,,31,article,,10.1145/3568813.3600124,"Tiffany Wenting Li, Silas Hsu, Max Fowler et al.","Errors in AI grading and feedback often have an intractable set of causes and are, by their nature, difficult to completely avoid. Since inaccurate feedback potentially harms learning, there is a need for designs and workflows that mitigate these harms. To better understand the mechanisms by which erroneous AI feedback impacts students’ learning, we conducted surveys and interviews that recorded students’ interactions with a short-answer AI autograder for “Explain in Plain English” code reading "
Systematic review and meta-analysis of AI-based conversational agents for promoting mental health and well-being,2023,,18,preprint,,10.31234/osf.io/m3vjt,"Han Li, Renwen Zhang, Yi‐Chieh Lee et al.","Conversational artificial intelligence (AI), particularly AI-based conversational agents (CAs), is gaining traction in mental health care. Despite their growing usage, there is a scarcity of comprehensive evaluations of their impact on mental health and well-being. This systematic review and meta-analysis aims to fill this gap by synthesizing evidence on the effectiveness of AI- based CAs in improving mental health and factors influencing their effectiveness and user experience. Twelve databases"
Trends and Opportunities in Sustainable Manufacturing: A Systematic Review of Key Dimensions from 2019 to 2024,2025,Sustainability,35,review,,10.3390/su17020789,"Antonius Setyadi, Sundari Soekotjo, Setyani Dwi Lestari et al.","Purpose: This systematic literature review analyzes trends, key findings, and research opportunities in manufacturing sustainability from 2019 to 2024, with a focus on the integration of emerging technologies and socio-economic dimensions. Methodology: a systematic review of 181 publications was conducted, emphasizing technological advancements, research gaps, and the influence of global events on sustainable manufacturing. Findings: the review highlights: (1) a shift towards advanced technologi"
Knowledge mapping and evolution of research on older adults’ technology acceptance: a bibliometric study from 2013 to 2023,2024,Humanities and Social Sciences Communications,27,article,,10.1057/s41599-024-03658-2,"Xianru Shang, Zijian Liu, Chen Gong et al.","The rapid expansion of information technology and the intensification of population aging are two prominent features of contemporary societal development. Investigating older adults’ acceptance and use of technology is key to facilitating their integration into an information-driven society. Given this context, the technology acceptance of older adults has emerged as a prioritized research topic, attracting widespread attention in the academic community. However, existing research remains fragme"
Leveraging Large Language Models to Power Chatbots for Collecting User Self-Reported Data,2023,arXiv (Cornell University),15,preprint,2301.05843,10.48550/arxiv.2301.05843,"Jing Wei, Sungdong Kim, Hyunhoon Jung et al.","Large language models (LLMs) provide a new way to build chatbots by accepting natural language prompts. Yet, it is unclear how to design prompts to power chatbots to carry on naturalistic conversations while pursuing a given goal, such as collecting self-report data from users. We explore what design factors of prompts can help steer chatbots to talk naturally and collect data reliably. To this aim, we formulated four prompt designs with different structures and personas. Through an online study"
The analysis of generative artificial intelligence technology for innovative thinking and strategies in animation teaching,2025,Scientific Reports,16,article,,10.1038/s41598-025-03805-y,"Yao Xu, Yaozhang Zhong, Weiran Cao","This work examines the application of Generative Artificial Intelligence (GAI) technology in animation teaching, focusing on its role in enhancing teaching quality and learning efficiency through innovative instructional strategies. Compared to traditional animation teaching methods, GAI technology introduces a novel pedagogical paradigm characterized by adaptive personalized learning pathways, intelligent teaching resource optimization, and immersive interactive learning models. A mixed-methods"
"Symmetric Therapeutic Frameworks and Ethical Dimensions in AI-Based Mental Health Chatbots (2020–2025): A Systematic Review of Design Patterns, Cultural Balance, and Structural Symmetry",2025,Symmetry,15,review,,10.3390/sym17071082,"Ali Algumaei, Noorayisahbe Mohd Yaacob, Mohamed Doheir et al.","Artificial intelligence (AI)-powered mental health chatbots have evolved quickly as scalable means for psychological support, bringing novel solutions through natural language processing (NLP), mobile accessibility, and generative AI. This systematic literature review (SLR), following PRISMA 2020 guidelines, collates evidence from 25 published, peer-reviewed studies between 2020 and 2025 and reviews therapeutic techniques, cultural adaptation, technical design, system assessment, and ethics. Stu"
Decoding Complexity: Exploring Human-AI Concordance in Qualitative Coding,2024,arXiv (Cornell University),5,preprint,2403.06607,10.48550/arxiv.2403.06607,"Elisabeth Kirsten, Annalina Buckmann, Abraham Mhaidli et al.","Qualitative data analysis provides insight into the underlying perceptions and experiences within unstructured data. However, the time-consuming nature of the coding process, especially for larger datasets, calls for innovative approaches, such as the integration of Large Language Models (LLMs). This short paper presents initial findings from a study investigating the integration of LLMs for coding tasks of varying complexity in a real-world dataset. Our results highlight the challenges inherent"
A survey on large language model based autonomous agents,2024,Frontiers of Computer Science,1083,article,,10.1007/s11704-024-40231-1,"Lei Wang, Chen Ma, Xueyang Feng et al.","Abstract Autonomous agents have long been a research focus in academic and industry communities. Previous research often focuses on training agents with limited knowledge within isolated environments, which diverges significantly from human learning processes, and makes the agents hard to achieve human-like decisions. Recently, through the acquisition of vast amounts of Web knowledge, large language models (LLMs) have shown potential in human-level intelligence, leading to a surge in research on"
A Survey of Large Language Models,2026,Frontiers of Computer Science,1398,preprint,2303.18223,10.1007/s11704-026-60308-3,"Wayne Xin Zhao, Kun Zhou, Junyi Li et al.","Abstract The rapid evolution of large language models (LLMs) has driven a transformative shift in artificial intelligence (AI), reshaping both research paradigms and practical applications. Distinguished from their predecessors by unprecedented scale and advanced capabilities, LLMs necessitate new frameworks for understanding their development, behavior, and societal impact. This survey systematically reviews recent advancements in LLM techniques across four key dimensions: (1) pre-training meth"
Generative AI,2023,Business & Information Systems Engineering,1129,article,2309.07930,10.1007/s12599-023-00834-7,"Stefan Feuerriegel, Jochen Hartmann, Christian Janiesch et al.","Generative AI, Artificial intelligence, Decision support, Content creation, Information systems"
Scaling Instruction-Finetuned Language Models,2022,arXiv (Cornell University),1187,preprint,2210.11416,10.48550/arxiv.2210.11416,"Hyung Won Chung, Le Hou, Shayne Longpre et al.","Finetuning language models on a collection of datasets phrased as instructions has been shown to improve model performance and generalization to unseen tasks. In this paper we explore instruction finetuning with a particular focus on (1) scaling the number of tasks, (2) scaling the model size, and (3) finetuning on chain-of-thought data. We find that instruction finetuning with the above aspects dramatically improves performance on a variety of model classes (PaLM, T5, U-PaLM), prompting setups "
MiniGPT-4: Enhancing Vision-Language Understanding with Advanced Large Language Models,2023,arXiv (Cornell University),476,preprint,2304.10592,10.48550/arxiv.2304.10592,"Deyao Zhu, Jun Chen, Xiaoqian Shen et al.","The recent GPT-4 has demonstrated extraordinary multi-modal abilities, such as directly generating websites from handwritten text and identifying humorous elements within images. These features are rarely observed in previous vision-language models. However, the technical details behind GPT-4 continue to remain undisclosed. We believe that the enhanced multi-modal generation capabilities of GPT-4 stem from the utilization of sophisticated large language models (LLM). To examine this phenomenon, "
Findings of the Association for Computational Linguistics: EMNLP 2023,2023,,348,paratext,,10.18653/v1/2023.findings-emnlp,"Graham Mcdougal, Caron, Shashank Srivastava et al.",
HuggingGPT: Solving AI Tasks with ChatGPT and its Friends in Hugging Face,2023,arXiv (Cornell University),264,preprint,2303.17580,10.48550/arxiv.2303.17580,"Yongliang Shen, Kaitao Song, Xu Tan et al.","Solving complicated AI tasks with different domains and modalities is a key step toward artificial general intelligence. While there are numerous AI models available for various domains and modalities, they cannot handle complicated AI tasks autonomously. Considering large language models (LLMs) have exhibited exceptional abilities in language understanding, generation, interaction, and reasoning, we advocate that LLMs could act as a controller to manage existing AI models to solve complicated A"
Siren's Song in the AI Ocean: A Survey on Hallucination in Large Language Models,2023,arXiv (Cornell University),240,preprint,2309.01219,10.48550/arxiv.2309.01219,"Yue Zhang, Yafu Li, Leyang Cui et al.","While large language models (LLMs) have demonstrated remarkable capabilities across a range of downstream tasks, a significant concern revolves around their propensity to exhibit hallucinations: LLMs occasionally generate content that diverges from the user input, contradicts previously generated context, or misaligns with established world knowledge. This phenomenon poses a substantial challenge to the reliability of LLMs in real-world scenarios. In this paper, we survey recent efforts on the d"
A framework for human evaluation of large language models in healthcare derived from literature review,2024,npj Digital Medicine,262,article,,10.1038/s41746-024-01258-7,"Thomas Yu Chow Tam, Sonish Sivarajkumar, Sumit Kapoor et al.","With generative artificial intelligence (GenAI), particularly large language models (LLMs), continuing to make inroads in healthcare, assessing LLMs with human evaluations is essential to assuring safety and effectiveness. This study reviews existing literature on human evaluation methodologies for LLMs in healthcare across various medical specialties and addresses factors such as evaluation dimensions, sample types and sizes, selection, and recruitment of evaluators, frameworks and metrics, eva"
"A Survey on ChatGPT: AI–Generated Contents, Challenges, and Solutions",2023,IEEE Open Journal of the Computer Society,318,article,,10.1109/ojcs.2023.3300321,"Yuntao Wang, Yanghe Pan, Miao Yan et al.","With the widespread use of large artificial intelligence (AI) models such as ChatGPT, AI-generated content (AIGC) has garnered increasing attention and is leading a paradigm shift in content creation and knowledge representation. AIGC uses generative large AI algorithms to assist or replace humans in creating massive, high-quality, and human-like content at a faster pace and lower cost, based on user-provided prompts. Despite the recent significant progress in AIGC, security, privacy, ethical, a"
Large language models for generative information extraction: a survey,2024,Frontiers of Computer Science,206,article,,10.1007/s11704-024-40555-y,"Derong Xu, Wei Chen, Wenjun Peng et al.","Abstract Information Extraction (IE) aims to extract structural knowledge from plain natural language texts. Recently, generative Large Language Models (LLMs) have demonstrated remarkable capabilities in text understanding and generation. As a result, numerous works have been proposed to integrate LLMs for IE tasks based on a generative paradigm. To conduct a comprehensive systematic review and exploration of LLM efforts for IE tasks, in this study, we survey the most recent advancements in this"
"Database Resources of the National Genomics Data Center, China National Center for Bioinformation in 2025",2024,Nucleic Acids Research,294,article,,10.1093/nar/gkae978,"CNCB-NGDC Members and Partners, Yīmíng Bào, Xue Bai et al.","The National Genomics Data Center (NGDC), which is a part of the China National Center for Bioinformation (CNCB), offers a comprehensive suite of database resources to support the global scientific community. Amidst the unprecedented accumulation of multi-omics data, CNCB-NGDC is committed to continually evolving and updating its core database resources through big data archiving, integrative analysis and value-added curation. Over the past year, CNCB-NGDC has expanded its collaborations with in"
"Artificial Intelligence Alone Will Not Democratise Education: On Educational Inequality, Techno-Solutionism and Inclusive Tools",2024,Sustainability,185,article,,10.3390/su16020781,"Sahan Bulathwela, María Pérez‐Ortiz, Catherine Holloway et al.","Artificial Intelligence (AI) in Education claims to have the potential for building personalised curricula, as well as bringing opportunities for democratising education and creating a renaissance of new ways of teaching and learning. Millions of students are starting to benefit from the use of these technologies, but millions more around the world are not, due to the digital divide and deep pre-existing social and educational inequalities. If this trend continues, the first large-scale delivery"
ChatGLM: A Family of Large Language Models from GLM-130B to GLM-4 All Tools,2024,arXiv (Cornell University),176,preprint,2406.12793,10.48550/arxiv.2406.12793,"Team GLM, :, Aohan Zeng et al.","We introduce ChatGLM, an evolving family of large language models that we have been developing over time. This report primarily focuses on the GLM-4 language series, which includes GLM-4, GLM-4-Air, and GLM-4-9B. They represent our most capable models that are trained with all the insights and lessons gained from the preceding three generations of ChatGLM. To date, the GLM-4 models are pre-trained on ten trillions of tokens mostly in Chinese and English, along with a small set of corpus from 24 "
"Large language models in medical and healthcare fields: applications, advances, and challenges",2024,Artificial Intelligence Review,188,article,,10.1007/s10462-024-10921-0,"Dandan Wang, Shiqing Zhang","Large language models (LLMs) are increasingly recognized for their advanced language capabilities, offering significant assistance in diverse areas like medical communication, patient data optimization, and surgical planning. Our survey meticulously searched for papers with keywords such as “medical,” “clinical,” “healthcare,” and “LLMs” across various databases, including ACM and Google Scholar. It sought to delve into the latest trends and applications of LLMs in healthcare, analyzing 175 rele"
StarCoder: may the source be with you!,2023,arXiv (Cornell University),192,preprint,2305.06161,10.48550/arxiv.2305.06161,"Raymond Li, Loubna Ben Allal, Yangtian Zi et al.","The BigCode community, an open-scientific collaboration working on the responsible development of Large Language Models for Code (Code LLMs), introduces StarCoder and StarCoderBase: 15.5B parameter models with 8K context length, infilling capabilities and fast large-batch inference enabled by multi-query attention. StarCoderBase is trained on 1 trillion tokens sourced from The Stack, a large collection of permissively licensed GitHub repositories with inspection tools and an opt-out process. We "
