title,year,venue,cited_by,type,arxiv,doi,authors,abstract
Prompt Injection attack against LLM-integrated Applications,2023,arXiv (Cornell University),77,preprint,2306.05499,10.48550/arxiv.2306.05499,"Yi Liu, Gelei Deng, Yuekang Li et al.","Large Language Models (LLMs), renowned for their superior proficiency in language comprehension and generation, stimulate a vibrant ecosystem of applications around them. However, their extensive assimilation into various services introduces significant security risks. This study deconstructs the complexities and implications of prompt injection attacks on actual LLM-integrated applications. Initially, we conduct an exploratory analysis on ten commercial applications, highlighting the constraint"
Causal Inference Meets Deep Learning: A Comprehensive Survey,2024,Research,78,review,,10.34133/research.0467,"Licheng Jiao, Yuhan Wang, Xu Liu et al.","Deep learning relies on learning from extensive data to generate prediction results. This approach may inadvertently capture spurious correlations within the data, leading to models that lack interpretability and robustness. Researchers have developed more profound and stable causal inference methods based on cognitive neuroscience. By replacing the correlation model with a stable and interpretable causal model, it is possible to mitigate the misleading nature of spurious correlations and overco"
Large Language Models and Knowledge Graphs: Opportunities and Challenges,2023,arXiv (Cornell University),64,preprint,2308.06374,10.4230/tgdk.1.1.2,"Jeff Z. Pan, Simon Razniewski, Jan-Christoph Kalo et al.","Large Language Models (LLMs) have taken Knowledge Representation - and the world - by storm. This inflection point marks a shift from explicit knowledge representation to a renewed focus on the hybrid representation of both explicit knowledge and parametric knowledge. In this position paper, we will discuss some of the common debate points within the community on LLMs (parametric knowledge) and Knowledge Graphs (explicit knowledge) and speculate on opportunities and visions that the renewed focu"
"A Survey of Knowledge Graph Reasoning on Graph Types: Static, Dynamic, and Multimodal",2022,arXiv (Cornell University),48,preprint,2212.05767,10.48550/arxiv.2212.05767,"Ke Liang, Lingyuan Meng, Meng Liu et al.","Knowledge graph reasoning (KGR), aiming to deduce new facts from existing facts based on mined logic rules underlying knowledge graphs (KGs), has become a fast-growing research direction. It has been proven to significantly benefit the usage of KGs in many AI applications, such as question answering, recommendation systems, and etc. According to the graph types, existing KGR models can be roughly divided into three categories, i.e., static models, temporal models, and multi-modal models. Early w"
One Fits All:Power General Time Series Analysis by Pretrained LM,2023,arXiv (Cornell University),117,preprint,2302.11939,10.48550/arxiv.2302.11939,"Tian Zhou, Peisong Niu, Xue Wang et al.","Although we have witnessed great success of pre-trained models in natural language processing (NLP) and computer vision (CV), limited progress has been made for general time series analysis. Unlike NLP and CV where a unified model can be used to perform different tasks, specially designed approach still dominates in each time series analysis task such as classification, anomaly detection, forecasting, and few-shot learning. The main challenge that blocks the development of pre-trained model for "
Machine Learning for Synthetic Data Generation: A Review,2023,arXiv (Cornell University),81,review,2302.04062,10.48550/arxiv.2302.04062,"Yingzhou Lu, Chen, Lulu, Zhang, Yuanyuan et al.","Machine learning heavily relies on data, but real-world applications often encounter various data-related issues. These include data of poor quality, insufficient data points leading to under-fitting of machine learning models, and difficulties in data access due to concerns surrounding privacy, safety, and regulations. In light of these challenges, the concept of synthetic data generation emerges as a promising alternative that allows for data sharing and utilization in ways that real-world dat"
Can LLMs Generate Novel Research Ideas? A Large-Scale Human Study with 100+ NLP Researchers,2024,arXiv (Cornell University),41,preprint,2409.04109,10.48550/arxiv.2409.04109,"Chenglei Si, Diyi Yang, Tatsunori Hashimoto","Recent advancements in large language models (LLMs) have sparked optimism about their potential to accelerate scientific discovery, with a growing number of works proposing research agents that autonomously generate and validate new ideas. Despite this, no evaluations have shown that LLM systems can take the very first step of producing novel, expert-level ideas, let alone perform the entire research process. We address this by establishing an experimental design that evaluates research idea gen"
A survey of techniques for optimizing transformer inference,2023,Journal of Systems Architecture,125,article,,10.1016/j.sysarc.2023.102990,"Krishna Teja Chitty-Venkata, Sparsh Mittal, Murali Emani et al.",
Visual cognition in multimodal large language models,2025,Nature Machine Intelligence,38,article,,10.1038/s42256-024-00963-y,"Luca M. Schulze Buschoff, Elif Akata, Matthias Bethge et al.","Abstract A chief goal of artificial intelligence is to build machines that think like people. Yet it has been argued that deep neural network architectures fail to accomplish this. Researchers have asserted these models’ limitations in the domains of causal reasoning, intuitive physics and intuitive psychology. Yet recent advancements, namely the rise of large language models, particularly those designed for visual processing, have rekindled interest in the potential to emulate human-like cognit"
Revisiting the Gold Standard: Grounding Summarization Evaluation with Robust Human Evaluation,2023,,50,article,,10.18653/v1/2023.acl-long.228,"Yixin Liu, Alex Fabbri, Pengfei Liu et al.","Yixin Liu, Alex Fabbri, Pengfei Liu, Yilun Zhao, Linyong Nan, Ruilin Han, Simeng Han, Shafiq Joty, Chien-Sheng Wu, Caiming Xiong, Dragomir Radev. Proceedings of the 61st Annual Meeting of the Association for Computational Linguistics (Volume 1: Long Papers). 2023."
Towards the next generation of Geospatial Artificial Intelligence,2025,International Journal of Applied Earth Observation and Geoinformation,47,article,,10.1016/j.jag.2025.104368,"Gengchen Mai, Yiqun Xie, Xiaowei Jia et al.","Geospatial Artificial Intelligence (GeoAI), as the integration of geospatial studies and AI, has become one of the fastest-developing research directions in spatial data science and geography. This rapid change in the field calls for a deeper understanding of the recent developments and envision where the field is going in the near future. In this work, we provide a quantitative analysis of the GeoAI literature from the spatial, temporal, and semantic aspects. We briefly discuss the history of A"
GPT4Tools: Teaching Large Language Model to Use Tools via Self-instruction,2023,arXiv (Cornell University),33,preprint,2305.18752,10.48550/arxiv.2305.18752,"Rui Yang, Song Lin, Yanwei Li et al.","This paper aims to efficiently enable Large Language Models (LLMs) to use multimodal tools. Advanced proprietary LLMs, such as ChatGPT and GPT-4, have shown great potential for tool usage through sophisticated prompt engineering. Nevertheless, these models typically rely on prohibitive computational costs and publicly inaccessible data. To address these challenges, we propose the GPT4Tools based on self-instruct to enable open-source LLMs, such as LLaMA and OPT, to use tools. It generates an ins"
SecV: LLM-based Secure Verilog Generation with Clue-Guided Exploration on Hardware-CWE Knowledge Graph,2024,,31,article,,10.24963/ijcai.2024/895,"Fanghao Fan, YingJie Xia, Li Kuang","Verilog is specified as the primary Register Transfer Level (RTL) hardware description language, which designs the logical functions between registers for digital circuit systems. Recently, there emerges much cutting-edge research in leveraging Large Language Models (LLMs) to generate Verilog, aiming at effectively reducing errors and costs in the logic design of chips. However, these works mainly focus on logical correctness or PPA (Power, Performance, Area) measurement of the generated results"
AI Reasoning in Deep Learning Era: From Symbolic AI to Neural–Symbolic AI,2025,Mathematics,34,article,,10.3390/math13111707,"Baoyu Liang, Yuchen Wang, Chao Tong","The pursuit of Artificial General Intelligence (AGI) demands AI systems that not only perceive but also reason in a human-like manner. While symbolic systems pioneered early breakthroughs in logic-based reasoning, such as MYCIN and DENDRAL, they suffered from brittleness and poor scalability. Conversely, modern deep learning architectures have achieved remarkable success in perception tasks, yet continue to fall short in interpretable and structured reasoning. This dichotomy has motivated growin"
Deep Learning Workload Scheduling in GPU Datacenters: A Survey,2023,ACM Computing Surveys,81,review,,10.1145/3638757,"Zhisheng Ye, Wei Gao, Qinghao Hu et al.","Deep learning (DL) has demonstrated its remarkable success in a wide variety of fields. The development of a DL model is a time-consuming and resource-intensive procedure. Hence, dedicated GPU accelerators have been collectively constructed into a GPU datacenter. An efficient scheduler design for a GPU datacenter is crucially important to reduce operational cost and improve resource utilization. However, traditional approaches designed for big data or high-performance computing workloads can not"
Small Models are Valuable Plug-ins for Large Language Models,2024,,34,article,,10.18653/v1/2024.findings-acl.18,"Canwen Xu, Xu Yi‐chong, Shuohang Wang et al.","Large language models (LLMs) such as GPT-3 and GPT-4 are powerful but their weights are often publicly unavailable and their immense sizes make the models difficult to be tuned with common hardware.As a result, effectively tuning these models with large-scale supervised data can be challenging.As an alternative, In-Context Learning (ICL) can only use a small number of supervised examples due to context length limits.In this paper, we propose Super In-Context Learning (SuperICL) which allows blac"
ARPDL: Adaptive Relational Prior Distribution Loss as an Adapter for Document-Level Relation Extraction,2024,,42,article,,10.24963/ijcai.2024/924,"Huangming Xu, Fu Zhang, Jingwei Cheng et al.","The goal of document-level relation extraction (DocRE) is to identify relations between entities from multiple sentences. As a multi-label classification task, a common approach is to determine whether there are relations for an entity pair by selecting a multi-label classification threshold, with scores of relations above the threshold predicted as positive and the rest as negative. However, we find that predicting multiple relations for entity pairs causes the decrease of predicted scores in p"
Integration of large language models and federated learning,2024,Patterns,29,review,,10.1016/j.patter.2024.101098,"Chaochao Chen, Xiaohua Feng, Yuyuan Li et al.","As the parameter size of large language models (LLMs) continues to expand, there is an urgent need to address the scarcity of high-quality data. In response, existing research has attempted to make a breakthrough by incorporating federated learning (FL) into LLMs. Conversely, considering the outstanding performance of LLMs in task generalization, researchers have also tried applying LLMs within FL to tackle challenges in relevant domains. The complementarity between LLMs and FL has already ignit"
Domain Specialization as the Key to Make Large Language Models Disruptive: A Comprehensive Survey,2023,arXiv (Cornell University),73,preprint,2305.18703,10.48550/arxiv.2305.18703,"Chen Ling, Xujiang Zhao, Jiaying Lu et al.","Large language models (LLMs) have significantly advanced the field of natural language processing (NLP), providing a highly useful, task-agnostic foundation for a wide range of applications. However, directly applying LLMs to solve sophisticated problems in specific domains meets many hurdles, caused by the heterogeneity of domain data, the sophistication of domain knowledge, the uniqueness of domain objectives, and the diversity of the constraints (e.g., various social norms, cultural conformit"
A Survey on the Use of Large Language Models (LLMs) in Fake News,2024,Future Internet,47,article,,10.3390/fi16080298,"Eleftheria Papageorgiou, Christos Chronis, Iraklis Varlamis et al.","The proliferation of fake news and fake profiles on social media platforms poses significant threats to information integrity and societal trust. Traditional detection methods, including rule-based approaches, metadata analysis, and human fact-checking, have been employed to combat disinformation, but these methods often fall short in the face of increasingly sophisticated fake content. This review article explores the emerging role of Large Language Models (LLMs) in enhancing the detection of f"
PaLI-X: On Scaling up a Multilingual Vision and Language Model,2023,arXiv (Cornell University),38,preprint,2305.18565,10.48550/arxiv.2305.18565,"Xi Chen, Josip Djolonga, Piotr Padlewski et al.","We present the training recipe and results of scaling up PaLI-X, a multilingual vision and language model, both in terms of size of the components and the breadth of its training task mixture. Our model achieves new levels of performance on a wide-range of varied and complex tasks, including multiple image-based captioning and question-answering tasks, image-based document understanding and few-shot (in-context) learning, as well as object detection, video question answering, and video captionin"
Chatbot Arena: An Open Platform for Evaluating LLMs by Human Preference,2024,arXiv (Cornell University),97,preprint,2403.04132,10.4230/lipics.cp.2024.25,"Régin, Florian, De Maria, Elisabetta, Bonlarron, Alexandre","Constraint Programming (CP) and Machine Learning (ML) face challenges in text generation due to CP’s struggle with implementing ""meaning"" and ML’s difficulty with structural constraints. This paper proposes a solution by combining both approaches and embedding a Large Language Model (LLM) in CP. The LLM handles word generation and meaning, while CP manages structural constraints. This approach builds on GenCP, an improved version of On-the-fly Constraint Programming Search (OTFS) using LLM-gener"
Evaluating Large Language Models: A Comprehensive Survey,2023,arXiv (Cornell University),61,preprint,2310.19736,10.48550/arxiv.2310.19736,"Zishan Guo, Renren Jin, Chuang LIU et al.","Large language models (LLMs) have demonstrated remarkable capabilities across a broad spectrum of tasks. They have attracted significant attention and been deployed in numerous downstream applications. Nevertheless, akin to a double-edged sword, LLMs also present potential risks. They could suffer from private data leaks or yield inappropriate, harmful, or misleading content. Additionally, the rapid progress of LLMs raises concerns about the potential emergence of superintelligent systems withou"
Improving Automatic VQA Evaluation Using Large Language Models,2024,Proceedings of the AAAI Conference on Artificial Intelligence,30,article,,10.1609/aaai.v38i5.28212,"Oscar Mañas, Benno Krojer, Aishwarya Agrawal","8 years after the visual question answering (VQA) task was proposed, accuracy remains the primary metric for automatic evaluation. VQA Accuracy has been effective so far in the IID evaluation setting. However, our community is undergoing a shift towards open-ended generative models and OOD evaluation. In this new paradigm, the existing VQA Accuracy metric is overly stringent and underestimates the performance of VQA systems. Thus, there is a need to develop more robust automatic VQA metrics that"
A Comprehensive Review of Data‐Driven Co‐Speech Gesture Generation,2023,Computer Graphics Forum,93,review,,10.1111/cgf.14776,"Simbarashe Nyatsanga, Taras Kucherenko, C. Ahuja et al.","Abstract Gestures that accompany speech are an essential part of natural and efficient embodied human communication. The automatic generation of such co‐speech gestures is a long‐standing problem in computer animation and is considered an enabling technology for creating believable characters in film, games, and virtual social spaces, as well as for interaction with social robots. The problem is made challenging by the idiosyncratic and non‐periodic nature of human co‐speech gesture motion, and "
Large Language Model Alignment: A Survey,2023,arXiv (Cornell University),34,preprint,2309.15025,10.48550/arxiv.2309.15025,"Tianhao Shen, Renren Jin, Yufei Huang et al.","Recent years have witnessed remarkable progress made in large language models (LLMs). Such advancements, while garnering significant attention, have concurrently elicited various concerns. The potential of these models is undeniably vast; however, they may yield texts that are imprecise, misleading, or even detrimental. Consequently, it becomes paramount to employ alignment techniques to ensure these models to exhibit behaviors consistent with human values. This survey endeavors to furnish an ex"
From Crowdsourced Data to High-Quality Benchmarks: Arena-Hard and BenchBuilder Pipeline,2024,arXiv (Cornell University),6,preprint,2406.11939,10.48550/arxiv.2406.11939,"Tianle Li, Wei-Lin Chiang, Evan Frick et al.","The rapid evolution of Large Language Models (LLMs) has outpaced the development of model evaluation, highlighting the need for continuous curation of new, challenging benchmarks. However, manual curation of high-quality, human-aligned benchmarks is expensive and time-consuming. To address this, we introduce BenchBuilder, an automated pipeline that leverages LLMs to curate high-quality, open-ended prompts from large, crowd-sourced datasets, enabling continuous benchmark updates without human in "
Constructing Domain-Specific Evaluation Sets for LLM-as-a-judge,2024,,6,article,,10.18653/v1/2024.customnlp4u-1.14,"Ravi Raju, Swayambhoo Jain, Bo Li et al.","Ravi Shanker Raju, Swayambhoo Jain, Bo Li, Jonathan Lingjie Li, Urmish Thakker. Proceedings of the 1st Workshop on Customizable NLP: Progress and Challenges in Customizing NLP for a Domain, Application, Group, or Individual (CustomNLP4U). 2024."
Long-form factuality in large language models,2024,arXiv (Cornell University),10,preprint,2403.18802,10.48550/arxiv.2403.18802,"Jerry Wei, Chengrun Yang, Xinying Song et al.","Large language models (LLMs) often generate content that contains factual errors when responding to fact-seeking prompts on open-ended topics. To benchmark a model's long-form factuality in open domains, we first use GPT-4 to generate LongFact, a prompt set comprising thousands of questions spanning 38 topics. We then propose that LLM agents can be used as automated evaluators for long-form factuality through a method which we call Search-Augmented Factuality Evaluator (SAFE). SAFE utilizes an L"
LLM-as-a-Judge: automated evaluation of search query parsing using large language models,2025,Frontiers in Big Data,8,article,,10.3389/fdata.2025.1611389,"Mehmet Baysan, Serkan Uysal, İrem İşlek et al.","Introduction: The adoption of Large Language Models (LLMs) in search systems necessitates new evaluation methodologies beyond traditional rule-based or manual approaches. Methods: We propose a general framework for evaluating structured outputs using LLMs, focusing on search query parsing within an online classified platform. Our approach leverages LLMs' contextual reasoning capabilities through three evaluation methodologies: Pointwise, Pairwise, and Pass/Fail assessments. Additionally, we intr"
Evaluating Large Language Models at Evaluating Instruction Following,2023,arXiv (Cornell University),11,preprint,2310.07641,10.48550/arxiv.2310.07641,"Zhiyuan Zeng, Jiatong Yu, Tianyu Gao et al.","As research in large language models (LLMs) continues to accelerate, LLM-based evaluation has emerged as a scalable and cost-effective alternative to human evaluations for comparing the ever increasing list of models. This paper investigates the efficacy of these ``LLM evaluators'', particularly in using them to assess instruction following, a metric that gauges how closely generated text adheres to the given instruction. We introduce a challenging meta-evaluation benchmark, LLMBar, designed to "
AFaCTA: Assisting the Annotation of Factual Claim Detection with Reliable LLM Annotators,2024,,11,article,,10.18653/v1/2024.acl-long.104,"Jingwei Ni, Minjing Shi, Dominik Stammbach et al.","Jingwei Ni, Minjing Shi, Dominik Stammbach, Mrinmaya Sachan, Elliott Ash, Markus Leippold. Proceedings of the 62nd Annual Meeting of the Association for Computational Linguistics (Volume 1: Long Papers). 2024."
Re-evaluating Automatic LLM System Ranking for Alignment with Human Preference,2025,,4,article,,10.18653/v1/2025.findings-naacl.260,"Mingqi Gao, Yixin Liu, Xinyu Hu et al.","Evaluating and ranking the capabilities of different LLMs is crucial for understanding their performance and alignment with human preferences.Due to the high cost and timeconsuming nature of human evaluations, an automatic LLM bencher (i.e., an automatic evaluation framework that aims to rank LLMs based on their alignment with human preferences) is indispensable.An automatic LLM bencher consists of four components: the input set (e.g., a user instruction), the evaluation model (e.g., an LLM), th"
"Cambrian-1: A Fully Open, Vision-Centric Exploration of Multimodal LLMs",2024,arXiv (Cornell University),12,preprint,2406.16860,10.48550/arxiv.2406.16860,"Shengbang Tong, Ellis Brown, Penghao Wu et al.","We introduce Cambrian-1, a family of multimodal LLMs (MLLMs) designed with a vision-centric approach. While stronger language models can enhance multimodal capabilities, the design choices for vision components are often insufficiently explored and disconnected from visual representation learning research. This gap hinders accurate sensory grounding in real-world scenarios. Our study uses LLMs and visual instruction tuning as an interface to evaluate various visual representations, offering new "
Self-Alignment with Instruction Backtranslation,2023,arXiv (Cornell University),13,preprint,2308.06259,10.48550/arxiv.2308.06259,"Xian Li, Ping Yu, Chunting Zhou et al.","We present a scalable method to build a high quality instruction following language model by automatically labelling human-written text with corresponding instructions. Our approach, named instruction backtranslation, starts with a language model finetuned on a small amount of seed data, and a given web corpus. The seed model is used to construct training examples by generating instruction prompts for web documents (self-augmentation), and then selecting high quality examples from among these ca"
Are LLMs Better than Reported? Detecting Label Errors and Mitigating Their Effect on Model Performance,2025,,9,article,,10.18653/v1/2025.emnlp-main.1360,"Omer Nahum, Nitay Calderon, Orgad Keller et al.","NLP benchmarks rely on standardized datasets for training and evaluating models and are crucial for advancing the field.Traditionally, expert annotations ensure high-quality labels; however, the cost of expert annotation does not scale well with the growing demand for larger datasets required by modern models.While crowd-sourcing provides a more scalable solution, it often comes at the expense of annotation precision and consistency.Recent advancements in large language models (LLMs) offer new o"
"Training an LLM-as-a-Judge Model: Pipeline, Insights, and Practical Lessons",2025,,4,preprint,2502.02988,10.1145/3701716.3715265,"Renjun Hu, Cheng Yi, Libin Meng et al.","The rapid advancement of large language models (LLMs) has opened new possibilities for their adoption as evaluative judges. This paper introduces Themis, a fine-tuned LLM judge that delivers sophisticated context-aware evaluations. We provide a comprehensive overview of the development pipeline for Themis, highlighting its scenario-dependent evaluation prompts and two novel methods for controlled instruction generation. These designs enable Themis to effectively distill evaluative skills from te"
Trust or Escalate: LLM Judges with Provable Guarantees for Human Agreement,2024,arXiv (Cornell University),3,preprint,2407.18370,10.48550/arxiv.2407.18370,"Jaehun Jung, Faeze Brahman, Yejin Choi","We present a principled approach to provide LLM-based evaluation with a rigorous guarantee of human agreement. We first propose that a reliable evaluation method should not uncritically rely on model preferences for pairwise evaluation, but rather assess the confidence of judge models and selectively decide when to trust its judgement. We then show that under this selective evaluation framework, human agreement can be provably guaranteed -- such that the model evaluation aligns with that of huma"
Evaluating Step-by-step Reasoning Traces: A Survey,2025,,5,article,,10.18653/v1/2025.findings-emnlp.94,"Jinu Lee, Julia Hockenmaier","Step-by-step reasoning is widely used to enhance the reasoning ability of large language models (LLMs) in complex problems.Evaluating the quality of reasoning traces is crucial for understanding and improving LLM reasoning.However, existing evaluation practices are highly inconsistent, resulting in fragmented progress across evaluator design and benchmark development.To address this gap, this survey provides a comprehensive overview of step-by-step reasoning evaluation, proposing a taxonomy of e"
