title,year,venue,cited_by,type,arxiv,doi,authors,abstract
Interpreting Black-Box Models: A Review on Explainable Artificial Intelligence,2023,Cognitive Computation,1654,review,,10.1007/s12559-023-10179-8,"Vikas Hassija, Vinay Chamola, Atmesh Mahapatra et al.","Abstract Recent years have seen a tremendous growth in Artificial Intelligence (AI)-based methodological development in a broad range of domains. In this rapidly evolving field, large number of methods are being reported using machine learning (ML) and Deep Learning (DL) models. Majority of these models are inherently complex and lacks explanations of the decision making process causing these models to be termed as 'Black-Box'. One of the major bottlenecks to adopt such models in mission-critica"
"Reporting reliability, convergent and discriminant validity with structural equation modeling: A review and best-practice recommendations",2023,Asia Pacific Journal of Management,1780,review,,10.1007/s10490-023-09871-y,"Gordon W. Cheung, Helena D. Cooper–Thomas, Rebecca S. Lau et al.","Abstract Many constructs in management studies, such as perceptions, personalities, attitudes, and behavioral intentions, are not directly observable. Typically, empirical studies measure such constructs using established scales with multiple indicators. When the scales are used in a different population, the items are translated into other languages or revised to adapt to other populations, it is essential for researchers to report the quality of measurement scales before using them to test hyp"
Practical and ethical challenges of large language models in education: A systematic scoping review,2023,British Journal of Educational Technology,652,article,,10.1111/bjet.13370,"Lixiang Yan, Lele Sha, Linxuan Zhao et al.","Abstract Educational technology innovations leveraging large language models (LLMs) have shown the potential to automate the laborious process of generating and analysing textual content. While various innovations have been developed to automate a range of educational tasks (eg, question generation, feedback provision, and essay grading), there are concerns regarding the practicality and ethicality of these innovations. Such concerns may hinder future research and the adoption of LLMs‐based inno"
<scp>ChatGPT</scp> and a new academic reality: <scp>Artificial Intelligence‐written</scp> research papers and the ethics of the large language models in scholarly publishing,2023,Journal of the Association for Information Science and Technology,758,article,2303.13367,10.1002/asi.24750,"Brady Lund, Ting Wang, Nishith Reddy Mannuru et al.","Abstract This article discusses OpenAI's ChatGPT, a generative pre‐trained transformer, which uses natural language processing to fulfill text‐based user requests (i.e., a “chatbot”). The history and principles behind ChatGPT and similar models are discussed. This technology is then discussed in relation to its potential impact on academia and scholarly research and publishing. ChatGPT is seen as a potential model for the automated preparation of essays and other types of scholarly manuscripts. "
Algorithmic fairness in artificial intelligence for medicine and healthcare,2023,Nature Biomedical Engineering,563,review,,10.1038/s41551-023-01056-8,"Richard J. Chen, Judy J. Wang, Drew F. K. Williamson et al.",
Academic Integrity considerations of AI Large Language Models in the post-pandemic era: ChatGPT and beyond,2023,Journal of University Teaching and Learning Practice,648,article,,10.53761/1.20.02.07,Mike Perkins,"This paper explores the academic integrity considerations of students’ use of Artificial Intelligence (AI) tools using Large Language Models (LLMs) such as ChatGPT in formal assessments. We examine the evolution of these tools, and highlight the potential ways that LLMs can support in the education of students in digital writing and beyond, including the teaching of writing and composition, the possibilities of co-creation between humans and AI, supporting EFL learners, and improving Automated W"
"Fake news, disinformation and misinformation in social media: a review",2023,Social Network Analysis and Mining,666,review,,10.1007/s13278-023-01028-5,"Esma Aı̈meur, Sabrine Amri, Gilles Brassard",
From Anecdotal Evidence to Quantitative Evaluation Methods: A Systematic Review on Evaluating Explainable AI,2023,ACM Computing Surveys,462,review,,10.1145/3583558,"Meike Nauta, Jan Trienes, Shreyasi Pathak et al.","The rising popularity of explainable artificial intelligence (XAI) to understand high-performing black boxes raised the question of how to evaluate explanations of machine learning (ML) models. While interpretability and explainability are often presented as a subjectively validated binary property, we consider it a multi-faceted concept. We identify 12 conceptual properties, such as Compactness and Correctness, that should be evaluated for comprehensively assessing the quality of an explanation"
Capabilities of GPT-4 on Medical Challenge Problems,2023,arXiv (Cornell University),504,preprint,2303.13375,10.48550/arxiv.2303.13375,"Harsha Nori, Nicholas King, Scott Mayer McKinney et al.","Large language models (LLMs) have demonstrated remarkable capabilities in natural language understanding and generation across various domains, including medicine. We present a comprehensive evaluation of GPT-4, a state-of-the-art LLM, on medical competency examinations and benchmark datasets. GPT-4 is a general-purpose model that is not specialized for medical problems through training or engineered to solve clinical tasks. Our analysis covers two sets of official practice materials for the USM"
Graph of Thoughts: Solving Elaborate Problems with Large Language Models,2024,Proceedings of the AAAI Conference on Artificial Intelligence,396,article,,10.1609/aaai.v38i16.29720,"Maciej Besta, Nils Blach, Ales Kubicek et al.","We introduce Graph of Thoughts (GoT): a framework that advances prompting capabilities in large language models (LLMs) beyond those offered by paradigms such as Chain-of-Thought or Tree of Thoughts (ToT). The key idea and primary advantage of GoT is the ability to model the information generated by an LLM as an arbitrary graph, where units of information (""LLM thoughts"") are vertices, and edges correspond to dependencies between these vertices. This approach enables combining arbitrary LLM thoug"
Do <scp>AI</scp> chatbots improve students learning outcomes? Evidence from a meta‐analysis,2023,British Journal of Educational Technology,460,article,,10.1111/bjet.13334,"Rong Wu, Zhonggen Yu","Abstract Artificial intelligence (AI) chatbots are gaining increasing popularity in education. Due to their increasing popularity, many empirical studies have been devoted to exploring the effects of AI chatbots on students' learning outcomes. The proliferation of experimental studies has highlighted the need to summarize and synthesize the inconsistent findings about the effects of AI chatbots on students' learning outcomes. However, few reviews focused on the meta‐analysis of the effects of AI"
Judging LLM-as-a-Judge with MT-Bench and Chatbot Arena,2023,arXiv (Cornell University),453,preprint,2306.05685,10.48550/arxiv.2306.05685,"Lianmin Zheng, Wei-Lin Chiang, Ying Sheng et al.","Evaluating large language model (LLM) based chat assistants is challenging due to their broad capabilities and the inadequacy of existing benchmarks in measuring human preferences. To address this, we explore using strong LLMs as judges to evaluate these models on more open-ended questions. We examine the usage and limitations of LLM-as-a-judge, including position, verbosity, and self-enhancement biases, as well as limited reasoning ability, and propose solutions to mitigate some of them. We the"
Teachers’ AI digital competencies and twenty-first century skills in the post-pandemic world,2023,Educational Technology Research and Development,560,article,,10.1007/s11423-023-10203-6,"Davy Tsz Kit Ng, Jac Ka Lok Leung, Jiahong Su et al.",
Can Large Language Models Transform Computational Social Science?,2023,Computational Linguistics,420,article,,10.1162/coli_a_00502,"Caleb Ziems, William A. Held, Omar Ahmed Shaikh et al.","Abstract Large language models (LLMs) are capable of successfully performing many language processing tasks zero-shot (without training data). If zero-shot LLMs can also reliably classify and explain social phenomena like persuasiveness and political ideology, then LLMs could augment the computational social science (CSS) pipeline in important ways. This work provides a road map for using LLMs as CSS tools. Towards this end, we contribute a set of prompting best practices and an extensive evalua"
QLoRA: Efficient Finetuning of Quantized LLMs,2023,arXiv (Cornell University),493,preprint,2305.14314,10.48550/arxiv.2305.14314,"Tim Dettmers, Artidoro Pagnoni, Ari Holtzman et al.","We present QLoRA, an efficient finetuning approach that reduces memory usage enough to finetune a 65B parameter model on a single 48GB GPU while preserving full 16-bit finetuning task performance. QLoRA backpropagates gradients through a frozen, 4-bit quantized pretrained language model into Low Rank Adapters~(LoRA). Our best model family, which we name Guanaco, outperforms all previous openly released models on the Vicuna benchmark, reaching 99.3% of the performance level of ChatGPT while only "
"A meta systematic review of artificial intelligence in higher education: a call for increased ethics, collaboration, and rigour",2024,International Journal of Educational Technology in Higher Education,514,article,,10.1186/s41239-023-00436-z,"Melissa Bond, Hassan Khosravi, Maarten de Laat et al.","Abstract Although the field of Artificial Intelligence in Education (AIEd) has a substantial history as a research domain, never before has the rapid evolution of AI applications in education sparked such prominent public discourse. Given the already rapidly growing AIEd literature base in higher education, now is the time to ensure that the field has a solid research and conceptual grounding. This review of reviews is the first comprehensive meta review to explore the scope and nature of AIEd i"
Deep learning models for digital image processing: a review,2024,Artificial Intelligence Review,511,review,,10.1007/s10462-023-10631-z,"R Archana, P. S. Eliahim Jeevaraj",
"Generative AI in healthcare: an implementation science informed translational path on application, integration and governance",2024,Implementation Science,422,review,,10.1186/s13012-024-01357-9,Sandeep Reddy,"BACKGROUND: Artificial intelligence (AI), particularly generative AI, has emerged as a transformative tool in healthcare, with the potential to revolutionize clinical decision-making and improve health outcomes. Generative AI, capable of generating new data such as text and images, holds promise in enhancing patient care, revolutionizing disease diagnosis and expanding treatment options. However, the utility and impact of generative AI in healthcare remain poorly understood, with concerns around"
Harnessing the Power of LLMs in Practice: A Survey on ChatGPT and Beyond,2024,ACM Transactions on Knowledge Discovery from Data,457,article,,10.1145/3649506,"Jingfeng Yang, Hongye Jin, Ruixiang Tang et al.","This article presents a comprehensive and practical guide for practitioners and end-users working with Large Language Models (LLMs) in their downstream Natural Language Processing (NLP) tasks. We provide discussions and insights into the usage of LLMs from the perspectives of models, data, and downstream tasks. First, we offer an introduction and brief summary of current language models. Then, we discuss the influence of pre-training data, training data, and test data. Most importantly, we provi"
Towards Expert-Level Medical Question Answering with Large Language Models,2023,arXiv (Cornell University),334,preprint,2305.09617,10.48550/arxiv.2305.09617,"Karan Singhal, Tao Tu, Juraj Gottweis et al.","Recent artificial intelligence (AI) systems have reached milestones in ""grand challenges"" ranging from Go to protein-folding. The capability to retrieve medical knowledge, reason over it, and answer medical questions comparably to physicians has long been viewed as one such grand challenge. Large language models (LLMs) have catalyzed significant progress in medical question answering; Med-PaLM was the first model to exceed a ""passing"" score in US Medical Licensing Examination (USMLE) style quest"
Promises and challenges of generative artificial intelligence for human learning,2024,Nature Human Behaviour,305,review,,10.1038/s41562-024-02004-5,"Lixiang Yan, Samuel Greiff, Ziwen Teuber et al.",
The Impact of Generative AI on Critical Thinking: Self-Reported Reductions in Cognitive Effort and Confidence Effects From a Survey of Knowledge Workers,2025,,281,article,,10.1145/3706598.3713778,"Hao-Ping Lee, Advait Sarkar, Lev Tankelevitch et al.","The rise of Generative AI (GenAI) in knowledge workflows raises questions about its impact on critical thinking skills and practices.We survey 319 knowledge workers to investigate 1) when and how they perceive the enaction of critical thinking when using GenAI, and 2) when and why GenAI affects their effort to do so.Participants shared 936 first-hand examples of using GenAI in work tasks.Quantitatively, when considering both task-and user-specific factors, a user's task-specific self-confidence "
Synthetic Lies: Understanding AI-Generated Misinformation and Evaluating Algorithmic and Human Solutions,2023,,253,article,,10.1145/3544548.3581318,"Jiawei Zhou, Yixuan Zhang, Qianni Luo et al.","Large language models have abilities in creating high-volume human-like texts and can be used to generate persuasive misinformation. However, the risks remain under-explored. To address the gap, this work first examined characteristics of AI-generated misinformation (AI-misinfo) compared with human creations, and then evaluated the applicability of existing solutions. We compiled human-created COVID-19 misinformation and abstracted it into narrative prompts for a language model to output AI-misi"
"Harnessing the power of synthetic data in healthcare: innovation, application, and privacy",2023,npj Digital Medicine,332,review,,10.1038/s41746-023-00927-3,"Mauro Giuffrè, Dennis Shung","Data-driven decision-making in modern healthcare underpins innovation and predictive analytics in public health and clinical research. Synthetic data has shown promise in finance and economics to improve risk assessment, portfolio optimization, and algorithmic trading. However, higher stakes, potential liabilities, and healthcare practitioner distrust make clinical use of synthetic data difficult. This paper explores the potential benefits and limitations of synthetic data in the healthcare anal"
Explainable Artificial Intelligence (XAI) 2.0: A manifesto of open challenges and interdisciplinary research directions,2024,Information Fusion,457,article,,10.1016/j.inffus.2024.102301,"Luca Longo, Mario Brčić, Federico Cabitza et al.","Understanding black box models has become paramount as systems based on opaque Artificial Intelligence (AI) continue to flourish in diverse real-world applications. In response, Explainable AI (XAI) has emerged as a field of research with practical and ethical benefits across various domains. This paper highlights the advancements in XAI and its application in real-world scenarios and addresses the ongoing challenges within XAI, emphasizing the need for broader perspectives and collaborative eff"
"Metaverse for Healthcare: A Survey on Potential Applications, Challenges and Future Directions",2023,IEEE Access,479,article,,10.1109/access.2023.3241628,"Rajeswari Chengoden, Nancy Victor, Thien Huynh‐The et al.","The rapid progress in digitalization and automation have led to an accelerated growth in healthcare, generating novel models that are creating new channels for rendering treatment at reduced cost. The Metaverse is an emerging technology in the digital space which has huge potential in healthcare, enabling realistic experiences to the patients as well as the medical practitioners. The Metaverse is a confluence of multiple enabling technologies such as artificial intelligence, virtual reality, aug"
A study of generative large language model for medical research and healthcare,2023,npj Digital Medicine,363,article,,10.1038/s41746-023-00958-w,"Peng Cheng, Xi Yang, Aokun Chen et al.","There are enormous enthusiasm and concerns in applying large language models (LLMs) to healthcare. Yet current assumptions are based on general-purpose LLMs such as ChatGPT, which are not developed for medical use. This study develops a generative clinical LLM, GatorTronGPT, using 277 billion words of text including (1) 82 billion words of clinical text from 126 clinical departments and approximately 2 million patients at the University of Florida Health and (2) 195 billion words of diverse gene"
"From patterns to patients: Advances in clinical machine learning for cancer diagnosis, prognosis, and treatment",2023,Cell,544,review,,10.1016/j.cell.2023.01.035,"Kyle Swanson, Eric Q. Wu, Angela Zhang et al.",
Benchmarking Large Language Models for News Summarization,2024,Transactions of the Association for Computational Linguistics,308,article,,10.1162/tacl_a_00632,"Tianyi Zhang, Faisal Ladhak, Esin Durmus et al.","Abstract Large language models (LLMs) have shown promise for automatic summarization but the reasons behind their successes are poorly understood. By conducting a human evaluation on ten LLMs across different pretraining methods, prompts, and model scales, we make two important observations. First, we find instruction tuning, not model size, is the key to the LLM’s zero-shot summarization capability. Second, existing studies have been limited by low-quality references, leading to underestimates "
Human heuristics for AI-generated language are flawed,2023,Proceedings of the National Academy of Sciences,259,article,,10.1073/pnas.2208839120,"Maurice Jakesch, Jeffrey T. Hancock, Mor Naaman","Human communication is increasingly intermixed with language generated by AI. Across chat, email, and social media, AI systems suggest words, complete sentences, or produce entire conversations. AI-generated language is often not identified as such but presented as language written by humans, raising concerns about novel forms of deception and manipulation. Here, we study how humans discern whether verbal self-presentations, one of the most personal and consequential forms of language, were gene"
"Social interactions in the metaverse: Framework, initial evidence, and research roadmap",2022,Journal of the Academy of Marketing Science,383,article,,10.1007/s11747-022-00908-0,"Thorsten Hennig‐Thurau, Dorothea Nilusha Aliman, Alina Marie Herting et al.","Abstract Real-time multisensory social interactions (RMSIs) between people are at the center of the metaverse, a new computer-mediated environment consisting of virtual “worlds” in which people act and communicate with each other in real-time via avatars. This research investigates whether RMSIs in the metaverse, when accessed through virtual-reality headsets, can generate more value for interactants in terms of interaction outcomes (interaction performance, evaluation, and emotional responses) "
Fairness in Machine Learning: A Survey,2023,ACM Computing Surveys,435,review,2010.04053,10.1145/3616865,"Simon Caton, Christian Haas","When Machine Learning technologies are used in contexts that affect citizens, companies as well as researchers need to be confident that there will not be any unexpected social implications, such as bias towards gender, ethnicity, and/or people with disabilities. There is significant literature on approaches to mitigate bias and promote fairness, yet the area is complex and hard to penetrate for newcomers to the domain. This article seeks to provide an overview of the different schools of though"
"A critical evaluation, challenges, and future perspectives of using artificial intelligence and emerging technologies in smart classrooms",2023,Smart Learning Environments,309,review,,10.1186/s40561-023-00231-3,"Elenı Dimitriadou, Andreas Lanitis","The term ""Smart Classroom"" has evolved over time and nowadays reflects the technological advancements incorporated in educational spaces. The rapid advances in technology, and the need to create more efficient and creative classes that support both in-class and remote activities, have led to the integration of Artificial Intelligence and smart technologies in smart classes. In this paper we discuss the concept of Artificial Intelligence in Education and present a literature review related to sma"
Digitization of healthcare sector: A study on privacy and security concerns,2023,ICT Express,322,article,,10.1016/j.icte.2023.02.007,"Metty Paul, Λέανδρος Μαγλαράς, Mohamed Amine Ferrag et al.","The digital revolution has taken business sectors to a new height through the advancement of technology. The healthcare sector also embraced digital technology to facilitate technological change from mechanical and analogue electronic devices to the digital technology that is available today. The common use of digital technology in the healthcare sector includes searching medical knowledge resources, monitoring quality patient care and improving clinical support. The article presents the impact "
The impact of generative artificial intelligence on socioeconomic inequalities and policy making,2024,PNAS Nexus,278,article,,10.1093/pnasnexus/pgae191,"Valerio Capraro, Austin Lentsch, Daron Acemoğlu et al.","Abstract Generative artificial intelligence (AI) has the potential to both exacerbate and ameliorate existing socioeconomic inequalities. In this article, we provide a state-of-the-art interdisciplinary overview of the potential impacts of generative AI on (mis)information and three information-intensive domains: work, education, and healthcare. Our goal is to highlight how generative AI could worsen existing inequalities while illuminating how AI may help mitigate pervasive social problems. In "
The Programmer’s Assistant: Conversational Interaction with a Large Language Model for Software Development,2023,,234,preprint,2302.07080,10.1145/3581641.3584037,"Steven Ross, Fernando Martinez, Stephanie Houde et al.","Large language models (LLMs) have recently been applied in software engineering to perform tasks such as translating code between programming languages, generating code from natural language, and autocompleting code as it is being written. When used within development tools, these systems typically treat each model invocation independently from all previous invocations, and only a specific limited functionality is exposed within the user interface. This approach to user interaction misses an opp"
Evaluating Large Language Models in Generating Synthetic HCI Research Data: a Case Study,2023,,232,article,,10.1145/3544548.3580688,"Perttu Hämäläinen, Mikke Tavast, Anton Kunnari","Collecting data is one of the bottlenecks of Human-Computer Interaction (HCI) research. Motivated by this, we explore the potential of large language models (LLMs) in generating synthetic user research data. We use OpenAI’s GPT-3 model to generate open-ended questionnaire responses about experiencing video games as art, a topic not tractable with traditional computational user models. We test whether synthetic responses can be distinguished from real responses, analyze errors of synthetic data, "
Using Large Language Models to Enhance Programming Error Messages,2023,,208,article,,10.1145/3545945.3569770,"Juho Leinonen, Arto Hellas, Sami Sarsa et al.","A key part of learning to program is learning to understand programming error messages. They can be hard to interpret and identifying the cause of errors can be time-consuming. One factor in this challenge is that the messages are typically intended for an audience that already knows how to program, or even for programming environments that then use the information to highlight areas in code. Researchers have been working on making these errors more novice friendly since the 1960s, however progr"
"Remote patient monitoring using artificial intelligence: Current state, applications, and challenges",2023,Wiley Interdisciplinary Reviews Data Mining and Knowledge Discovery,451,article,2301.10009,10.1002/widm.1485,"Thanveer Shaik, Xiaohui Tao, Niall Higgins et al.","Abstract The adoption of artificial intelligence (AI) in healthcare is growing rapidly. Remote patient monitoring (RPM) is one of the common healthcare applications that assist doctors to monitor patients with chronic or acute illness at remote locations, elderly people in‐home care, and even hospitalized patients. The reliability of manual patient monitoring systems depends on staff time management which is dependent on their workload. Conventional patient monitoring involves invasive approache"
Towards Human-Centered Explainable AI: A Survey of User Studies for Model Explanations,2023,IEEE Transactions on Pattern Analysis and Machine Intelligence,200,review,,10.1109/tpami.2023.3331846,"Yao Rong, Tobias Leemann, Thai-trang Nguyen et al.","Explainable AI (XAI) is widely viewed as a sine qua non for ever-expanding AI research. A better understanding of the needs of XAI users, as well as human-centered evaluations of explainable models are both a necessity and a challenge. In this paper, we explore how human-computer interaction (HCI) and AI researchers conduct user studies in XAI applications based on a systematic literature review. After identifying and thoroughly analyzing 97 core papers with human-based XAI evaluations over the "
