title,year,venue,cited_by,type,arxiv,doi,authors,abstract,topical
A survey on large language model based autonomous agents,2024,Frontiers of Computer Science,1083,article,,10.1007/s11704-024-40231-1,"Lei Wang, Chen Ma, Xueyang Feng et al.","Abstract Autonomous agents have long been a research focus in academic and industry communities. Previous research often focuses on training agents with limited knowledge within isolated environments, which diverges significantly from human learning processes, and makes the agents hard to achieve human-like decisions. Recently, through the acquisition of vast amounts of Web knowledge, large language models (LLMs) have shown potential in human-level intelligence, leading to a surge in research on",True
ChatGPT outperforms crowd workers for text-annotation tasks,2023,Proceedings of the National Academy of Sciences,900,article,,10.1073/pnas.2305016120,"Fabrizio Gilardi, Meysam Alizadeh, Maël Kubli","Many NLP applications require manual text annotations for a variety of tasks, notably to train classifiers or evaluate the performance of unsupervised models. Depending on the size and degree of complexity, the tasks may be conducted by crowd workers on platforms such as MTurk as well as trained annotators, such as research assistants. Using four samples of tweets and news articles ( n = 6,183), we show that ChatGPT outperforms crowd workers for several annotation tasks, including relevance, sta",True
The AI generation gap: Are Gen Z students more interested in adopting generative AI such as ChatGPT in teaching and learning than their Gen X and millennial generation teachers?,2023,Smart Learning Environments,500,article,,10.1186/s40561-023-00269-3,"Cecilia Ka Yuk Chan, Katherine K. W. Lee","Abstract This study aimed to explore the experiences, perceptions, knowledge, concerns, and intentions of Generation Z (Gen Z) students with Generation X (Gen X) and Generation Y (Gen Y) teachers regarding the use of generative AI (GenAI) in higher education. A sample of students and teachers were recruited to investigate the above using a survey consisting of both open and closed questions. The findings showed that Gen Z participants were generally optimistic about the potential benefits of Gen",True
"A Survey on ChatGPT: AI–Generated Contents, Challenges, and Solutions",2023,IEEE Open Journal of the Computer Society,318,article,,10.1109/ojcs.2023.3300321,"Yuntao Wang, Yanghe Pan, Miao Yan et al.","With the widespread use of large artificial intelligence (AI) models such as ChatGPT, AI-generated content (AIGC) has garnered increasing attention and is leading a paradigm shift in content creation and knowledge representation. AIGC uses generative large AI algorithms to assist or replace humans in creating massive, high-quality, and human-like content at a faster pace and lower cost, based on user-provided prompts. Despite the recent significant progress in AIGC, security, privacy, ethical, a",True
The Impact of Generative AI on Critical Thinking: Self-Reported Reductions in Cognitive Effort and Confidence Effects From a Survey of Knowledge Workers,2025,,281,article,,10.1145/3706598.3713778,"Hao-Ping Lee, Advait Sarkar, Lev Tankelevitch et al.","The rise of Generative AI (GenAI) in knowledge workflows raises questions about its impact on critical thinking skills and practices.We survey 319 knowledge workers to investigate 1) when and how they perceive the enaction of critical thinking when using GenAI, and 2) when and why GenAI affects their effort to do so.Participants shared 936 first-hand examples of using GenAI in work tasks.Quantitatively, when considering both task-and user-specific factors, a user's task-specific self-confidence ",True
The Rise and Potential of Large Language Model Based Agents: A Survey,2023,arXiv (Cornell University),250,preprint,2309.07864,10.48550/arxiv.2309.07864,"Zhiheng Xi, Wen-Xiang Chen, Xin Guo et al.","For a long time, humanity has pursued artificial intelligence (AI) equivalent to or surpassing the human level, with AI agents considered a promising vehicle for this pursuit. AI agents are artificial entities that sense their environment, make decisions, and take actions. Many efforts have been made to develop intelligent agents, but they mainly focus on advancement in algorithms or training strategies to enhance specific capabilities or performance on particular tasks. Actually, what the commu",True
"A comprehensive survey of ChatGPT: Advancements, applications, prospects, and challenges",2023,Meta-Radiology,234,article,,10.1016/j.metrad.2023.100022,"Anam Nazir, Ze Wang","Large Language Models (LLMs) especially when combined with Generative Pre-trained Transformers (GPT) represent a groundbreaking in natural language processing. In particular, ChatGPT, a state-of-the-art conversational language model with a user-friendly interface, has garnered substantial attention owing to its remarkable capability for generating human-like responses across a variety of conversational scenarios. This survey offers an overview of ChatGPT, delving into its inception, evolution, a",True
A multinational study on the factors influencing university students’ attitudes and usage of ChatGPT,2024,Scientific Reports,231,article,,10.1038/s41598-024-52549-8,"Maram Abdaljaleel, Muna Barakat, Mariam Alsanafi et al.","Artificial intelligence models, like ChatGPT, have the potential to revolutionize higher education when implemented properly. This study aimed to investigate the factors influencing university students' attitudes and usage of ChatGPT in Arab countries. The survey instrument ""TAME-ChatGPT"" was administered to 2240 participants from Iraq, Kuwait, Egypt, Lebanon, and Jordan. Of those, 46.8% heard of ChatGPT, and 52.6% used it before the study. The results indicated that a positive attitude and usag",True
Co-Writing with Opinionated Language Models Affects Users’ Views,2023,,227,preprint,2302.00560,10.1145/3544548.3581196,"Maurice Jakesch, Advait Bhat, Daniel Buschek et al.","If large language models like GPT-3 preferably produce a particular point of view, they may influence people’s opinions on an unknown scale. This study investigates whether a language-model-powered writing assistant that generates some opinions more often than others impacts what users write – and what they think. In an online experiment, we asked participants (N=1,506) to write a post discussing whether social media is good for society. Treatment group participants used a language-model-powered",True
HaluEval: A Large-Scale Hallucination Evaluation Benchmark for Large Language Models,2023,,227,article,,10.18653/v1/2023.emnlp-main.397,"Junyi Li, Xiaoxue Cheng, Xin Zhao et al.","Large language models (LLMs), such as ChatGPT, are prone to generate hallucinations, i.e., content that conflicts with the source or cannot be verified by the factual knowledge. To understand what types of content and to which extent LLMs are apt to hallucinate, we introduce the Hallucination Evaluation for Large Language Models (HaluEval) benchmark, a large collection of generated and human-annotated hallucinated samples for evaluating the performance of LLMs in recognizing hallucination. To ge",True
Future of education in the era of generative artificial intelligence: Consensus among Chinese scholars on applications of ChatGPT in schools,2023,Future in Educational Research,226,article,,10.1002/fer3.10,"Ming Liu, Yiling Ren, Lucy Michael Nyagoga et al.","Abstract ChatGPT is an artificial intelligence chatbot that utilizes advanced natural language processing technologies, including large language models, to produce human‐like responses to user queries spanning a wide range of topics from programming to mathematics. As an emerging generative artificial intelligence (GAI) tool, it presents novel opportunities and challenges to the ongoing digital transformation of education. This article employs a systematic review approach to summarize the viewpo",True
Can Generative AI improve social science?,2024,Proceedings of the National Academy of Sciences,225,article,,10.1073/pnas.2314021121,Christopher A. Bail,"Generative AI that can produce realistic text, images, and other human-like outputs is currently transforming many different industries. Yet it is not yet known how such tools might influence social science research. I argue Generative AI has the potential to improve survey research, online experiments, automated content analyses, agent-based models, and other techniques commonly used to study human behavior. In the second section of this article, I discuss the many limitations of Generative. I ",True
Supporting Qualitative Analysis with Large Language Models: Combining Codebook with GPT-3 for Deductive Coding,2023,,203,preprint,2304.10548,10.1145/3581754.3584136,"Ziang Xiao, Xingdi Yuan, Q. Vera Liao et al.","Qualitative analysis of textual contents unpacks rich and valuable information by assigning labels to the data. However, this process is often labor-intensive, particularly when working with large datasets. While recent AI-based tools demonstrate utility, researchers may not have readily available AI resources and expertise, let alone be challenged by the limited generalizability of those task-specific models. In this study, we explored the use of large language models (LLMs) in supporting deduc",True
Incorporating AI in foreign language education: An investigation into ChatGPT’s effect on foreign language learners,2024,Education and Information Technologies,187,article,,10.1007/s10639-024-12574-6,"Fatih Karataş, Faramarz Yaşar Abedi, Filiz Ozek Gunyel et al.","Abstract ChatGPT, an artificial intelligence application, has emerged as a promising educational tool with a wide range of applications, attracting the attention of researchers and educators. This qualitative case study, chosen for its ability to provide an in-depth exploration of the nuanced effects of AI on the foreign language learning process within its real-world educational context, aimed to utilize ChatGPT in foreign language education, addressing a gap in existing research by offering in",True
Performing an Inductive Thematic Analysis of Semi-Structured Interviews With a Large Language Model: An Exploration and Provocation on the Limits of the Approach,2023,Social Science Computer Review,176,article,,10.1177/08944393231220483,Stefano De Paoli,Large Language Models (LLMs) have emerged as powerful generative Artificial Intelligence solutions. This paper presents results and reflections of an experiment done with the LLM GPT 3.5-Turbo to perform an inductive Thematic Analysis (TA). Previous research has worked on conducting deductive analysis. Thematic Analysis is a qualitative method for analysis commonly used in social sciences and it is based on interpretations by the human analyst(s) and the identification of explicit and latent mea,True
"Student Perceptions of ChatGPT Use in a College Essay Assignment: Implications for Learning, Grading, and Trust in Artificial Intelligence",2024,IEEE Transactions on Learning Technologies,176,article,,10.1109/tlt.2024.3355015,"Chad C. Tossell, Nathan L. Tenhundfeld, Ali Momen et al.","This study examined student experiences before and after an essay writing assignment that required the use of ChatGPT within an undergraduate engineering course. Utilizing a pre-post study design, we gathered data from 24 participants to evaluate ChatGPT's support for both completing and grading an essay assignment, exploring its educational value and impact on the learning process. Our quantitative and thematic analyses uncovered that ChatGPT did not simplify the writing process. Instead, the t",True
ChatGPT-4 Outperforms Experts and Crowd Workers in Annotating Political Twitter Messages with Zero-Shot Learning,2023,arXiv (Cornell University),159,preprint,2304.06588,10.48550/arxiv.2304.06588,Petter Törnberg,"This paper assesses the accuracy, reliability and bias of the Large Language Model (LLM) ChatGPT-4 on the text analysis task of classifying the political affiliation of a Twitter poster based on the content of a tweet. The LLM is compared to manual annotation by both expert classifiers and crowd workers, generally considered the gold standard for such tasks. We use Twitter messages from United States politicians during the 2020 election, providing a ground truth against which to measure accuracy",True
A Comprehensive Survey on Pretrained Foundation Models: A History from BERT to ChatGPT,2023,arXiv (Cornell University),153,preprint,2302.09419,10.48550/arxiv.2302.09419,"Ce Zhou, Qian Li, Chen Li et al.","Pretrained Foundation Models (PFMs) are regarded as the foundation for various downstream tasks with different data modalities. A PFM (e.g., BERT, ChatGPT, and GPT-4) is trained on large-scale data which provides a reasonable parameter initialization for a wide range of downstream applications. BERT learns bidirectional encoder representations from Transformers, which are trained on large datasets as contextual language models. Similarly, the generative pretrained transformer (GPT) method employ",True
“It happened to be the perfect thing”: experiences of generative AI chatbots for mental health,2024,npj Mental Health Research,138,article,,10.1038/s44184-024-00097-4,"Steven Siddals, John Torous, Astrid Coxon","The global mental health crisis underscores the need for accessible, effective interventions. Chatbots based on generative artificial intelligence (AI), like ChatGPT, are emerging as novel solutions, but research on real-life usage is limited. We interviewed nineteen individuals about their experiences using generative AI chatbots for mental health. Participants reported high engagement and positive impacts, including better relationships and healing from trauma and loss. We developed four theme",True
Homogenization Effects of Large Language Models on Human Creative Ideation,2024,Creativity and Cognition,122,preprint,2402.01536,10.1145/3635636.3656204,"Barrett R. Anderson, Jash Hemant Shah, Max Kreminski","Large language models (LLMs) are now being used in a wide variety of contexts, including as creativity support tools (CSTs) intended to help their users come up with new ideas. But do LLMs actually support user creativity? We hypothesized that the use of an LLM as a CST might make the LLM’s users feel more creative, and even broaden the range of ideas suggested by each individual user, but also homogenize the ideas suggested by different users. We conducted a 36-participant comparative user stud",True
Graphologue: Exploring Large Language Model Responses with Interactive Diagrams,2023,,117,preprint,,10.1145/3586183.3606737,"Peiling Jiang, Jude Rayan, Steven P. Dow et al.","Large language models (LLMs) have recently soared in popularity due to their ease of access and the unprecedented ability to synthesize text responses to diverse user questions. However, LLMs like ChatGPT present significant limitations in supporting complex information tasks due to the insufficient affordances of the text-based medium and linear conversational structure. Through a formative study with ten participants, we found that LLM interfaces often present long-winded responses, making it ",True
A Survey on Large Language Model based Autonomous Agents,2023,arXiv (Cornell University),113,preprint,2308.11432,10.48550/arxiv.2308.11432,"Lei Wang, Chen Ma, Xueyang Feng et al.","Autonomous agents have long been a prominent research focus in both academic and industry communities. Previous research in this field often focuses on training agents with limited knowledge within isolated environments, which diverges significantly from human learning processes, and thus makes the agents hard to achieve human-like decisions. Recently, through the acquisition of vast amounts of web knowledge, large language models (LLMs) have demonstrated remarkable potential in achieving human-",True
Using ChatGPT for human–computer interaction research: a primer,2023,Royal Society Open Science,113,article,,10.1098/rsos.231053,"Wilbert Tabone, Joost de Winter","ChatGPT could serve as a tool for text analysis within the field of Human–Computer Interaction, though its validity requires investigation. This study applied ChatGPT to: (1) textbox questionnaire responses on nine augmented-reality interfaces, (2) interview data from participants who experienced these interfaces in a virtual simulator, and (3) transcribed think-aloud data of participants who viewed a real painting and its replica. Using a hierarchical approach, ChatGPT produced scores or summar",True
RePrompt: Automatic Prompt Editing to Refine AI-Generative Art Towards Precise Expressions,2023,,108,preprint,2302.09466,10.1145/3544548.3581402,"Yunlong Wang, Shuyuan Shen, Brian Y. Lim","Generative AI models have shown impressive ability to produce images with text prompts, which could benefit creativity in visual art creation and self-expression. However, it is unclear how precisely the generated images express contexts and emotions from the input texts. We explored the emotional expressiveness of AI-generated images and developed RePrompt, an automatic method to refine text prompts toward precise expression of the generated images. Inspired by crowdsourced editing strategies, ",True
"Prompts, Pearls, Imperfections: Comparing ChatGPT and a Human Researcher in Qualitative Data Analysis",2024,Qualitative Health Research,88,article,,10.1177/10497323241244669,"Jonas Wachinger, Kate Bärnighausen, Louis Noël Schäfer et al.","The impact of ChatGPT and other large language model-based applications on scientific work is being debated across contexts and disciplines. However, despite ChatGPT's inherent focus on language generation and processing, insights regarding its potential for supporting qualitative research and analysis remain limited. In this article, we advocate for an open discourse on chances and pitfalls of AI-supported qualitative analysis by exploring ChatGPT's performance when analyzing an interview trans",True
The ethics of using generative AI for qualitative data analysis,2024,Information Systems Journal,71,article,,10.1111/isj.12504,"Robert M. Davison, Hameed Chughtai, Petter Nielsen et al.",It is important to note that the text of this editorial is entirely written by humans without any Generative Artificial Intelligence (GAI) contribution or assistance. The Editor of the ISJ (Robert M. Davison) was contacted by one of the ISJ's Associate Editors (AE) (Marjolein van Offenbeek) who explained that the qualitative data analysis software ATLAS.ti was offering a free-of-charge analysis of research data if the researcher shared the same data with ATLAS.ti for training purposes for their ,True
Human-Algorithmic Interaction Using a Large Language Model-Augmented Artificial Intelligence Clinical Decision Support System,2024,,68,article,,10.1145/3613904.3642024,"Niroop Rajashekar, Yeo Eun Shin, 円 杉浦 et al.","Integration of artificial intelligence (AI) into clinical decision support systems (CDSS) poses a socio-technological challenge that is impacted by usability, trust, and human-computer interaction (HCI). AI-CDSS interventions have shown limited benefit in clinical outcomes, which may be due to insufficient understanding of how health-care providers interact with AI systems. Large language models (LLMs) have the potential to enhance AI-CDSS, but haven’t been studied in either simulated or real-wo",True
ChatGPT: Beginning of an End of Manual Linguistic Data Annotation? Use Case of Automatic Genre Identification,2023,arXiv (Cornell University),66,preprint,2303.03953,10.48550/arxiv.2303.03953,"Taja Kuzman, Igor Mozetič, Nikola Ljubešić","ChatGPT has shown strong capabilities in natural language generation tasks, which naturally leads researchers to explore where its abilities end. In this paper, we examine whether ChatGPT can be used for zero-shot text classification, more specifically, automatic genre identification. We compare ChatGPT with a multilingual XLM-RoBERTa language model that was fine-tuned on datasets, manually annotated with genres. The models are compared on test sets in two languages: English and Slovenian. Resul",True
Comparing the Efficacy and Efficiency of Human and Generative AI: Qualitative Thematic Analyses,2024,JMIR AI,65,article,,10.2196/54482,"Maximo Prescott, Samantha Yeager, Lillian Ham et al.","BACKGROUND: Qualitative methods are incredibly beneficial to the dissemination and implementation of new digital health interventions; however, these methods can be time intensive and slow down dissemination when timely knowledge from the data sources is needed in ever-changing health systems. Recent advancements in generative artificial intelligence (GenAI) and their underlying large language models (LLMs) may provide a promising opportunity to expedite the qualitative analysis of textual data,",True
LLM-Assisted Content Analysis: Using Large Language Models to Support Deductive Coding,2023,arXiv (Cornell University),64,preprint,2306.14924,10.48550/arxiv.2306.14924,"Robert Chew, John Bollenbacher, Michael Wenger et al.","Deductive coding is a widely used qualitative research method for determining the prevalence of themes across documents. While useful, deductive coding is often burdensome and time consuming since it requires researchers to read, interpret, and reliably categorize a large body of unstructured text documents. Large language models (LLMs), like ChatGPT, are a class of quickly evolving AI tools that can perform a range of natural language processing and reasoning tasks. In this study, we explore th",True
LLM-in-the-loop: Leveraging Large Language Model for Thematic Analysis,2023,,64,article,,10.18653/v1/2023.findings-emnlp.669,"Shih-Chieh Dai, Aiping Xiong, Lun‐Wei Ku","Thematic analysis (TA) has been widely used for analyzing qualitative data in many disciplines and fields. To ensure reliable analysis, the same piece of data is typically assigned to at least two human coders. Moreover, to produce meaningful and useful analysis, human coders develop and deepen their data interpretation and coding over multiple iterations, making TA labor-intensive and time-consuming. Recently the emerging field of large language models (LLMs) research has shown that LLMs have t",True
Redefining Qualitative Analysis in the AI Era: Utilizing ChatGPT for Efficient Thematic Analysis,2023,arXiv (Cornell University),63,preprint,2309.10771,10.48550/arxiv.2309.10771,"He Zhang, Chuhao Wu, Jingyi Xie et al.","AI tools, particularly large-scale language model (LLM) based applications such as ChatGPT, have the potential to simplify qualitative research. Through semi-structured interviews with seventeen participants, we identified challenges and concerns in integrating ChatGPT into the qualitative analysis process. Collaborating with thirteen qualitative researchers, we developed a framework for designing prompts to enhance the effectiveness of ChatGPT in thematic analysis. Our findings indicate that im",True
Generating Automatic Feedback on UI Mockups with Large Language Models,2024,,61,preprint,2403.13139,10.1145/3613904.3642782,"Peitong Duan, Jeremy Warner, Yang Li et al.","Feedback on user interface (UI) mockups is crucial in design. However, human feedback is not always readily available. We explore the potential of using large language models for automatic feedback. Specifically, we focus on applying GPT-4 to automate heuristic evaluation, which currently entails a human expert assessing a UI’s compliance with a set of design guidelines. We implemented a Figma plugin that takes in a UI design and a set of written heuristics, and renders automatically-generated f",True
From Google Gemini to OpenAI Q* (Q-Star): A Survey of Reshaping the Generative Artificial Intelligence (AI) Research Landscape,2023,arXiv (Cornell University),60,preprint,2312.10868,10.48550/arxiv.2312.10868,"Timothy R. McIntosh, Teo Sušnjak, Tong Liu et al.","This comprehensive survey explored the evolving landscape of generative Artificial Intelligence (AI), with a specific focus on the transformative impacts of Mixture of Experts (MoE), multimodal learning, and the speculated advancements towards Artificial General Intelligence (AGI). It critically examined the current state and future trajectory of generative Artificial Intelligence (AI), exploring how innovations like Google's Gemini and the anticipated OpenAI Q* project are reshaping research pr",True
Let the LLMs Talk: Simulating Human-to-Human Conversational QA via Zero-Shot LLM-to-LLM Interactions,2024,,59,article,,10.1145/3616855.3635856,"Zahra Abbasiantaeb, Yifei Yuan, Evangelos Kanoulas et al.","CQA systems aim to create interactive search systems that effectively retrieve information by interacting with users. To replicate human-to-human conversations, existing work uses human annotators to play the roles of the questioner (student) and the answerer (teacher). Despite its effectiveness, challenges exist as human annotation is time-consuming, inconsistent, and not scalable. To address this issue and investigate the applicability of LLM in CQA simulation, we propose a simulation framewor",True
Knowledge sharing in manufacturing using LLM-powered tools: user study and model benchmarking,2024,Frontiers in Artificial Intelligence,58,article,,10.3389/frai.2024.1293084,"Samuel Kernan Freire, Chaofan Wang, Mina Foosherian et al.","Recent advances in natural language processing enable more intelligent ways to support knowledge sharing in factories. In manufacturing, operating production lines has become increasingly knowledge-intensive, putting strain on a factory's capacity to train and support new operators. This paper introduces a Large Language Model (LLM)-based system designed to retrieve information from the extensive knowledge contained in factory documentation and knowledge shared by expert operators. The system ai",True
