title,year,venue,cited_by,type,arxiv,doi,authors,abstract,topical
Why and When LLM-Based Assistants Can Go Wrong: Investigating the Effectiveness of Prompt-Based Interactions for Software Help-Seeking,2024,,57,preprint,2402.08030,10.1145/3640543.3645200,"Anjali Khurana, Hariharan Subramonyam, Parmit K. Chilana","Large Language Model (LLM) assistants, such as ChatGPT, have emerged as potential alternatives to search methods for helping users navigate complex, feature-rich software. LLMs use vast training data from domain-specific texts, software manuals, and code repositories to mimic human-like interactions, offering tailored assistance, including step-by-step instructions. In this work, we investigated LLM-generated software guidance through a within-subject experiment with 16 participants and follow-u",True
Development and Evaluation of a Retrieval-Augmented Large Language Model Framework for Ophthalmology,2024,JAMA Ophthalmology,51,letter,,10.1001/jamaophthalmol.2024.2513,"Mingjie Luo, Jianyu Pang, Shaowei Bi et al.","Importance: Although augmenting large language models (LLMs) with knowledge bases may improve medical domain-specific performance, practical methods are needed for local implementation of LLMs that address privacy concerns and enhance accessibility for health care professionals. Objective: To develop an accurate, cost-effective local implementation of an LLM to mitigate privacy concerns and support their practical deployment in health care settings. Design, Setting, and Participants: ChatZOC (Su",True
Toward General Design Principles for Generative AI Applications,2023,arXiv (Cornell University),49,preprint,2301.05578,10.48550/arxiv.2301.05578,"Justin D. Weisz, Michael Müller, Jessica He et al.","Generative AI technologies are growing in power, utility, and use. As generative technologies are being incorporated into mainstream applications, there is a need for guidance on how to design those applications to foster productive and safe use. Based on recent research on human-AI co-creation within the HCI and AI communities, we present a set of seven principles for the design of generative AI applications. These principles are grounded in an environment of generative variability. Six princip",True
“It’s the only thing I can trust”: Envisioning Large Language Model Use by Autistic Workers for Communication Assistance,2024,,46,preprint,2403.03297,10.1145/3613904.3642894,"JiWoong Jang, Sanika Moharana, Patrick Carrington et al.","Autistic adults often experience stigma and discrimination at work, leading them to seek social communication support from coworkers, friends, and family despite emotional risks. Large language models (LLMs) are increasingly considered an alternative. In this work, we investigate the phenomenon of LLM use by autistic adults at work and explore opportunities and risks of LLMs as a source of social communication advice. We asked 11 autistic participants to present questions about their own workpla",True
Deus Ex Machina and Personas from Large Language Models: Investigating the Composition of AI-Generated Persona Descriptions,2024,,45,article,,10.1145/3613904.3642036,"Joni Salminen, Chang Liu, Wenjing Pian et al.","Large language models (LLMs) can generate personas based on prompts that describe the target user group. To understand what kind of personas LLMs generate, we investigate the diversity and bias in 450 LLM-generated personas with the help of internal evaluators (n=4) and subject-matter experts (SMEs) (n=5). The research findings reveal biases in LLM-generated personas, particularly in age, occupation, and pain points, as well as a strong bias towards personas from the United States. Human evaluat",True
ChatGPT in thematic analysis: Can AI become a research assistant in qualitative research?,2025,Quality & Quantity,42,article,,10.1007/s11135-025-02165-z,Kien Nguyen‐Trung,"Abstract Despite an emerging body of scholarship on applying generative AI (GenAI) to qualitative data analysis, this area remains underdeveloped. This article evaluates how GenAI can support thematic analysis using a publicly available interview dataset from Lumivero. It introduces Guided AI Thematic Analysis (GAITA), an adaptation of King et al.’s (2018) Template Analysis. This framework positions researchers as a reflexive instrument and intellectual leader while thoroughly guiding GPT-4 in f",True
"""If the Machine Is As Good As Me, Then What Use Am I?"" – How the Use of ChatGPT Changes Young Professionals' Perception of Productivity and Accomplishment",2024,,41,article,,10.1145/3613904.3641964,"Charlotte Kobiella, Y. López, Franz Waltenberger et al.","Large language models (LLMs) like ChatGPT have been widely adopted in work contexts. We explore the impact of ChatGPT on young professionals’ perception of productivity and sense of accomplishment. We collected LLMs’ main use cases in knowledge work through a preliminary study, which served as the basis for a two-week diary study with 21 young professionals reflecting on their ChatGPT use. Findings indicate that ChatGPT enhanced some participants’ perceptions of productivity and accomplishment b",True
Evaluating large language models in analysing classroom dialogue,2024,npj Science of Learning,39,article,,10.1038/s41539-024-00273-3,"Yun Liang Long, Haifeng Luo, Yu Zhang","This study explores the use of Large Language Models (LLMs), specifically GPT-4, in analysing classroom dialogue-a key task for teaching diagnosis and quality improvement. Traditional qualitative methods are both knowledge- and labour-intensive. This research investigates the potential of LLMs to streamline and enhance this process. Using datasets from middle school mathematics and Chinese classes, classroom dialogues were manually coded by experts and then analysed with a customised GPT-4 model",True
Humans or LLMs as the Judge? A Study on Judgement Bias,2024,,38,article,,10.18653/v1/2024.emnlp-main.474,"Guiming Hardy Chen, Shunian Chen, Ziche Liu et al.","Adopting human and large language models (LLM) as judges (a.k.a human-and LLM-as-ajudge) for evaluating the performance of LLMs has recently gained attention.Nonetheless, this approach concurrently introduces potential biases from human and LLMs, questioning the reliability of the evaluation results.In this paper, we propose a novel framework that is free from referencing groundtruth annotations for investigating Misinformation Oversight Bias, Gender Bias, Authority Bias and Beauty Bias on LLM a",True
Synthetic Replacements for Human Survey Data? The Perils of Large Language Models,2023,,36,preprint,,10.31235/osf.io/5ecfa,"James Bisbee, Joshua D. Clinton, Cassy Dorff et al.","Large Language Models (LLMs) offer new research possibilities for social scientists, but their potential as ""synthetic data"" is still largely unknown. In this paper, we investigate how accurately the popular closed-source LLM ChatGPT can recover public opinion, prompting the LLM to adopt different ""personas"" and then provide feeling thermometer scores for 11 sociopolitical groups. The average scores generated by ChatGPT correspond closely to the averages in our baseline survey, the 2016–2020 Ame",True
Automated Annotation with Generative AI Requires Validation,2023,arXiv (Cornell University),35,preprint,2306.00176,10.48550/arxiv.2306.00176,"Nicholas Pangakis, Samuel Wolken, Neil Fasching","Generative large language models (LLMs) can be a powerful tool for augmenting text annotation procedures, but their performance varies across annotation tasks due to prompt quality, text data idiosyncrasies, and conceptual difficulty. Because these challenges will persist even as LLM technology improves, we argue that any automated annotation process using an LLM must validate the LLM's performance against labels generated by humans. To this end, we outline a workflow to harness the annotation p",True
BeaverTails: Towards Improved Safety Alignment of LLM via a Human-Preference Dataset,2023,arXiv (Cornell University),34,preprint,2307.04657,10.48550/arxiv.2307.04657,"Jiaming Ji, Mickel Liu, Juntao Dai et al.","In this paper, we introduce the BeaverTails dataset, aimed at fostering research on safety alignment in large language models (LLMs). This dataset uniquely separates annotations of helpfulness and harmlessness for question-answering pairs, thus offering distinct perspectives on these crucial attributes. In total, we have gathered safety meta-labels for 333,963 question-answer (QA) pairs and 361,903 pairs of expert comparison data for both the helpfulness and harmlessness metrics. We further show",True
CoMPosT: Characterizing and Evaluating Caricature in LLM Simulations,2023,,33,article,,10.18653/v1/2023.emnlp-main.669,"Myra Cheng, Tiziano Piccardi, Diyi Yang","Recent work has aimed to capture nuances of human behavior by using LLMs to simulate responses from particular demographics in settings like social science experiments and public opinion surveys. However, there are currently no established ways to discuss or evaluate the quality of such LLM simulations. Moreover, there is growing concern that these LLM simulations are flattened caricatures of the personas that they aim to simulate, failing to capture the multidimensionality of people and perpetu",True
CoAnnotating: Uncertainty-Guided Work Allocation between Human and Large Language Models for Data Annotation,2023,,33,article,,10.18653/v1/2023.emnlp-main.92,"Minzhi Li, Taiwei Shi, Caleb Ziems et al.","Annotated data plays a critical role in Natural Language Processing (NLP) in training models and evaluating their performance. Given recent developments in Large Language Models (LLMs), models such as ChatGPT demonstrate zero-shot capability on many text-annotation tasks, comparable with or even exceeding human annotators. Such LLMs can serve as alternatives for manual annotation, due to lower costs and higher scalability. However, limited work has leveraged LLMs as complementary annotators, nor",True
Comparing GPT-4 and Human Researchers in Health Care Data Analysis: Qualitative Description Study,2024,Journal of Medical Internet Research,33,article,,10.2196/56500,"Kevin Li, Adrian Fernandez, Rachel Schwartz et al.","BACKGROUND: Large language models including GPT-4 (OpenAI) have opened new avenues in health care and qualitative research. Traditional qualitative methods are time-consuming and require expertise to capture nuance. Although large language models have demonstrated enhanced contextual understanding and inferencing compared with traditional natural language processing, their performance in qualitative analysis versus that of humans remains unexplored. OBJECTIVE: We evaluated the effectiveness of G",True
"“As an AI language model, I cannot”: Investigating LLM Denials of User Requests",2024,,33,article,,10.1145/3613904.3642135,"Joel Wester, Tim Schrills, Henning Pohl et al.","Users ask large language models (LLMs) to help with their homework, for lifestyle advice, or for support in making challenging decisions. Yet LLMs are often unable to fulfil these requests, either as a result of their technical inabilities or policies restricting their responses. To investigate the effect of LLMs denying user requests, we evaluate participants’ perceptions of different denial styles. We compare specific denial styles (baseline, factual, diverting, and opinionated) across two stu",True
SMILE: Single-turn to Multi-turn Inclusive Language Expansion via ChatGPT for Mental Health Support,2024,,32,article,,10.18653/v1/2024.findings-emnlp.34,"Huachuan Qiu, Hongliang He, Shuai Zhang et al.","Developing specialized dialogue systems for mental health support requires multi-turn conversation data, which has recently garnered increasing attention.However, gathering and releasing large-scale, real-life multi-turn conversations that could facilitate advancements in mental health support presents challenges in data privacy protection and the time and cost involved in crowdsourcing.To address these challenges, we introduce SMILE, a single-turn to multi-turn inclusive language expansion tech",True
"Conversational AI-Powered Design: ChatGPT as Designer, User, and Product",2023,arXiv (Cornell University),31,preprint,2302.07406,10.48550/arxiv.2302.07406,A. Baki Kocaballı,"The recent advancements in Large Language Models (LLMs), particularly conversational LLMs like ChatGPT, have prompted changes in a range of fields, including design. This study aims to examine the capabilities of ChatGPT in a human-centered design process. To this end, a hypothetical design project was conducted, where ChatGPT was utilized to generate personas, simulate interviews with fictional users, create new design ideas, simulate usage scenarios and conversations between an imaginary proto",True
NuNER: Entity Recognition Encoder Pre-training via LLM-Annotated Data,2024,,29,article,,10.18653/v1/2024.emnlp-main.660,"Sergei Bogdanov, Alexandre Constantin, Timothée Bernard et al.","Large Language Models (LLMs) have shown impressive abilities in data annotation, opening the way for new approaches to solve classic NLP problems.In this paper, we show how to use LLMs to create NuNER, a compact language representation model specialized in the Named Entity Recognition (NER) task.NuNER can be fine-tuned to solve downstream NER problems in a data-efficient way, outperforming similar-sized foundation models in the few-shot regime and competing with much larger LLMs.We find that the",True
ChatGPT to Replace Crowdsourcing of Paraphrases for Intent Classification: Higher Diversity and Comparable Model Robustness,2023,,25,article,,10.18653/v1/2023.emnlp-main.117,"Ján Čegiň, Jakub Šimko, Peter Brusilovsky","&lt;p&gt;The emergence of generative large language models (LLMs) raises the question: what will be its impact on crowdsourcing? Traditionally, crowdsourcing has been used for acquiring solutions to a wide variety of human-intelligence tasks, including ones involving text generation, modification or evaluation. For some of these tasks, models like ChatGPT can potentially substitute human workers. In this study, we investigate whether this is the case for the task of paraphrase generation for int",True
Qualitative Coding with GPT-4,2025,Journal of Learning Analytics,24,article,,10.18608/jla.2025.8575,"Xiner Liu, Andres Felipe Zambrano, Ryan S. Baker et al.","This study explores the potential of the large language model GPT-4 as an automated tool for qualitative data analysis by educational researchers, exploring which techniques are most successful for different types of constructs. Specifically, we assess three different prompt engineering strategies — Zero-shot, Few-shot, and Few-shot with contextual information — as well as the use of embeddings. We do so in the context of qualitatively coding three distinct educational datasets: Algebra I semi-p",True
Quantifying the Persona Effect in LLM Simulations,2024,,23,article,,10.18653/v1/2024.acl-long.554,"Tiancheng Hu, Nigel Collier","Large language models (LLMs) have shown remarkable promise in simulating human language and behavior.This study investigates how integrating persona variables-demographic, social, and behavioral factors-impacts LLMs' ability to simulate diverse perspectives.We find that persona variables account for <10% variance in annotations in existing subjective NLP datasets.Nonetheless, incorporating persona variables via prompting in LLMs provides modest but statistically significant improvements.Persona ",True
LLM-Based Agents for Tool Learning: A Survey,2025,Data Science and Engineering,22,article,,10.1007/s41019-025-00296-9,"Weikai Xu, Chengrui Huang, Shen Gao et al.","Abstract Human beings capable of making and using tools can accomplish tasks far beyond their innate abilities, and this paradigm of integration with tools may not be limited to humans themselves. Recently, the large language model (LLM) has demonstrated immense potential across various fields with its unique planning and reasoning abilities. However, there are still many challenges beyond its capabilities due to deficiencies in its training data and inherent illusions. Thus, integrating LLMs an",True
Designing for Human-Agent Alignment: Understanding what humans want from their agents,2024,,20,preprint,2404.04289,10.1145/3613905.3650948,"Nitesh Goyal, Minsuk Chang, Michael Terry","Our ability to build autonomous agents that leverage Generative AI continues to increase by the day. As builders and users of such agents it is unclear what parameters we need to align on before the agents start performing tasks on our behalf. To discover these parameters, we ran a qualitative empirical research study about designing agents that can negotiate during a fictional yet relatable task of selling a camera online. We found that for an agent to perform the task successfully, humans/user",True
Using Large Language Models to Enhance Exercise Recommendations and Physical Activity in Clinical and Healthy Populations: Scoping Review,2025,JMIR Medical Informatics,18,review,,10.2196/59309,"Xiangxun Lai, Jiacheng Chen, Yue Lai et al.","Background: Regular exercise recommendations (ERs) and physical activity (PA) are crucial for the prevention and management of chronic diseases. However, creating effective exercise programs demand substantial time and specialized expertise from both medical and sports professionals. Large language models (LLMs), such as ChatGPT, offer a promising solution by helping create personalized ERs. While LLMs show potential, their use in exercise planning remains in its early stages and requires furthe",True
Simulating Social Media Using Large Language Models to Evaluate Alternative News Feed Algorithms,2023,arXiv (Cornell University),18,preprint,2310.05984,10.48550/arxiv.2310.05984,"Petter Törnberg, Диляра Валеева, Justus Uitermark et al.",Social media is often criticized for amplifying toxic discourse and discouraging constructive conversations. But designing social media platforms to promote better conversations is inherently challenging. This paper asks whether simulating social media through a combination of Large Language Models (LLM) and Agent-Based Modeling can help researchers study how different news feed algorithms shape the quality of online conversations. We create realistic personas using data from the American Nation,True
ChatGPT vs. Crowdsourcing vs. Experts: Annotating Open-Domain Conversations with Speech Functions,2023,,17,article,,10.18653/v1/2023.sigdial-1.23,"Lidiia Ostyakova, Veronika Smilga, Kseniia Petukhova et al.","This paper deals with the task of annotating open-domain conversations with speech functions. We propose a semi-automated method for annotating dialogs following the topic-oriented, multi-layered taxonomy of speech functions with the use of hierarchical guidelines using Large Language Models. These guidelines comprise simple questions about the topic and speaker change, sentence types, pragmatic aspects of the utterance, and examples that aid untrained annotators in understanding the taxonomy. W",True
"A Survey on Large Language Models for Critical Societal Domains: Finance, Healthcare, and Law",2024,arXiv (Cornell University),16,preprint,2405.01769,10.48550/arxiv.2405.01769,"Zhiyu Zoey Chen, Jing Ma, Xinlu Zhang et al.","In the fast-evolving domain of artificial intelligence, large language models (LLMs) such as GPT-3 and GPT-4 are revolutionizing the landscapes of finance, healthcare, and law: domains characterized by their reliance on professional expertise, challenging data acquisition, high-stakes, and stringent regulatory compliance. This survey offers a detailed exploration of the methodologies, applications, challenges, and forward-looking opportunities of LLMs within these high-stakes sectors. We highlig",True
MEGAnno+: A Human-LLM Collaborative Annotation System,2024,,16,article,,10.18653/v1/2024.eacl-demo.18,"Hannah Kim, Kushan Mitra, Rafael Li Chen et al.","Hannah Kim, Kushan Mitra, Rafael Li Chen, Sajjadur Rahman, Dan Zhang. Proceedings of the 18th Conference of the European Chapter of the Association for Computational Linguistics: System Demonstrations. 2024.",True
The role of GPT in promoting inclusive higher education for people with various learning disabilities: a review,2025,PeerJ Computer Science,15,review,,10.7717/peerj-cs.2400,"Thippa Reddy Gadekallu, Gokul Yenduri, Rajesh Kaluri et al.","The generative pre-trained transformer (GPT) is a notable breakthrough in the field of artificial intelligence, as it empowers machines to effectively comprehend and engage in interactions with humans. The GPT exhibits the capacity to enhance inclusivity and accessibility for students with learning disabilities in the context of higher education, hence potentially facilitating substantial advancements in the field. GPT can provide personalized and diverse solutions that successfully cater to the",True
Large Language Model-Based Agents for Software Engineering: A Survey,2024,arXiv (Cornell University),13,preprint,2409.02977,10.48550/arxiv.2409.02977,"Junwei Liu, Kaixin Wang, Yixuan Chen et al.","The recent advance in Large Language Models (LLMs) has shaped a new paradigm of AI agents, i.e., LLM-based agents. Compared to standalone LLMs, LLM-based agents substantially extend the versatility and expertise of LLMs by enhancing LLMs with the capabilities of perceiving and utilizing external resources and tools. To date, LLM-based agents have been applied and shown remarkable effectiveness in Software Engineering (SE). The synergy between multiple agents and human interaction brings further ",True
GPT-4 as an X data annotator: Unraveling its performance on a stance classification task,2024,PLoS ONE,12,article,,10.1371/journal.pone.0307741,"Chandreen Ravihari Liyanage, Ravi Gokani, Vijay Mago","Data annotation in NLP is a costly and time-consuming task, traditionally handled by human experts who require extensive training to enhance the task-related background knowledge. Besides, labeling social media texts is particularly challenging due to their brevity, informality, creativity, and varying human perceptions regarding the sociocultural context of the world. With the emergence of GPT models and their proficiency in various NLP tasks, this study aims to establish a performance baseline",True
LATA: A Pilot Study on LLM-Assisted Thematic Analysis of Online Social Network Data Generation Experiences,2025,Proceedings of the ACM on Human-Computer Interaction,12,article,,10.1145/3711022,"Qile Wang, Moath Erqsous, Kenneth E. Barner et al.","Large Language Models (LLMs) have gained attention in research and industry, aiming to streamline processes and enhance text analysis performance. Thematic Analysis (TA), a prevalent qualitative method for analyzing interview content, often requires at least two human experts to review and analyze data. This study demonstrates the feasibility of LLM-Assisted Thematic Analysis (LATA) using GPT-4 and Gemini. Specifically, we conducted semi-structured interviews with 14 researchers to gather insigh",True
The Problems of LLM-generated Data in Social Science Research,2024,KTH Publication Database DiVA (KTH Royal Institute of Technology),10,article,,10.6092/issn.1971-8853/19576,"Luca Rossi, Katherine Harrison, Irina Shklovski","Beyond being used as fast and cheap annotators for otherwise complex classification tasks, LLMs have seen a growing adoption for generating synthetic data for social science and design research. Researchers have used LLM-generated data for data augmentation and prototyping, as well as for direct analysis where LLMs acted as proxies for real human subjects. LLM-based synthetic data build on fundamentally different epistemological assumptions than previous synthetically generated data and are just",True
Where AI and Design Meet - Designers’ Perceptions of AI Tools,2024,Nordic Conference on Human-Computer Interaction,10,article,,10.1145/3679318.3685388,"Matilda Kalving, Ashley Colley, Jonna Häkkilä","The creative industries are at a significant turning point, blurring the lines between human innovation and machine efficiency due to the advent of AI tools for design. This research addresses the design community’s reaction to generative AI’s rapid ascent. Involving both professionals and students, this paper uses a survey (n=49), focus groups (n=6), and interviews (n=6), to explore the perspectives on AI’s role in creative workflows, revealing a mix of enthusiasm and dread for its potential to",True
LLMs as Workers in Human-Computational Algorithms? Replicating Crowdsourcing Pipelines with LLMs,2023,arXiv (Cornell University),9,preprint,2307.10168,10.48550/arxiv.2307.10168,"Tongshuang Wu, Haiyi Zhu, Maya Albayrak et al.","LLMs have shown promise in replicating human-like behavior in crowdsourcing tasks that were previously thought to be exclusive to human abilities. However, current efforts focus mainly on simple atomic tasks. We explore whether LLMs can replicate more complex crowdsourcing pipelines. We find that modern LLMs can simulate some of crowdworkers' abilities in these ``human computation algorithms,'' but the level of success is variable and influenced by requesters' understanding of LLM capabilities, ",True
